waktu,username,text
2022-01-04 09:28:17+00:00,antaramakassar,West Ham jalin komunikasi dengan penyerang Gabriel Barbosa dari Flamengo
2022-01-04 09:28:17+00:00,mang_ib,RT Presiden menjadi tokoh terpopuler dan berpengaruh sepanjang 2021 nama beliau banyak dikutip media dan disebutka
2022-01-04 09:28:09+00:00,HarirahmaIzzah,RT Wah ada berita terbaru nih Katanya kredit usaha rakyat dimudahkan dengan bunga 6 Jadi berapa sih nilai plafon setiap
2022-01-04 09:28:06+00:00,anas_sharifudin,RT BERITA TERKINI Ada perempuan feminist panggil Allah SWT dengan ganti nama She bukan He Ini dah cukup melampau kera
2022-01-04 09:28:03+00:00,tvOneNews,Ratusan Paket Sembako dan Perabot Rumah Tangga untuk Korban Banjir Akibat Luapan Bengawan Njero
2022-01-04 09:27:58+00:00,ExcelJosaphine,Pak Erick Thohir menghadiri istighosah di Pondok Pesantren Amanatul Ummah
2022-01-04 09:27:56+00:00,Arindra__,RT Jadi para perempuan prasejahtera yang ingin menjadi pelaku usaha mikro bisa mendapatkan pinjaman modal dari program PNM Mek
2022-01-04 09:27:51+00:00,hogsemeade,RT Pendiriannya itu mencetus tentangan daripada para pegawai Israel dan juga pujian daripada pengguna media sosial yang pro Pale
2022-01-04 09:27:49+00:00,themightymokkie,RT Spekulasi tiga menteri bakal gugurkan daripada senarai jemaah kabinet sedang bertiup kencang ketika ini
2022-01-04 09:27:46+00:00,Necronnnn,RT Berita gembira untuk pengumpul topi Lepasni dah boleh cuci topi korang guna cover topi ni and campak dalam washin
2022-01-04 09:27:41+00:00,antaramakassar,Belasan warga Makassar rugi Rp10 miliar tertipu investasi bodong Tambang Digital
2022-01-04 09:27:33+00:00,aishahmokh,RT Tiada lagi walk in untuk dapatkan suntikan dos penggalak Protecthealth AWANInews AWANI745 Ha
2022-01-04 09:27:32+00:00,republikaonline,Saat ini revitalisasi tugu Pamulang sudah mencapai 98 persen tinggal bagian atap
2022-01-04 09:27:31+00:00,smolboiixx,RT Pendiriannya itu mencetus tentangan daripada para pegawai Israel dan juga pujian daripada pengguna media sosial yang pro Pale
2022-01-04 09:27:26+00:00,bharianmy,BHnasional Program bantu mangsa banjir turut dapat perhatian syarikat korporat
2022-01-04 09:27:16+00:00,MJtuhMasJoko,RT Bahar Smith Ditetapkan Jadi Tersangka Kuasa Hukum Kami Menduga Ada Sponsor Dibelakang Semua Ini
2022-01-04 09:27:15+00:00,Subhan76814326,RT Eijkman Dilebur ke BRIN PKS Khawatir Penelitian Diintervensi Politik
2022-01-04 09:27:14+00:00,voidotid,Nasib malang dialami seorang wanita anggota pasukan melati di Kota Medan Surtinem 45 Motor Honda Beat miliknya r
2022-01-04 09:27:13+00:00,bdleonanda,Sumber informasi tdk harus berasal dari texbook Bisa jadi dari jurnal dari berita koran dari blo
2022-01-04 09:27:11+00:00,KawuloA64321996,Nonton berita di Trans7 vaksin sinovac yg di akomodir pemerintah malah di perjual belikan sebagai bosster atau vak
2022-01-04 09:27:11+00:00,BernamaTV,Siti Nur Alia pelumba wanita pertama sertai pasukan berbasikal bertaraf dunia Berita penuh
2022-01-04 09:27:09+00:00,bobotohchelseas,RT Kasus Denny Siregar di Polda Jabar sudah berjalan lebih dari satu tahun
2022-01-04 09:26:52+00:00,Arindra__,RT Program yang digagas pak merupakan layanan sebagai pinjaman modal untuk perempuan yang ingin menjadi pelaku u
2022-01-04 09:26:40+00:00,ms_kualasimpang,Sambut Awal Tahun Pimpinan Mahkamah Syar iyah Kualasimpang Adakan Rapat Terbatas
2022-01-04 09:26:36+00:00,JungNeirin,palembang masuk berita
2022-01-04 09:26:33+00:00,Semut2Semut,Dania akbar viv4l Wicaksana2 Jangan suka menyebarkan ber
2022-01-04 09:26:26+00:00,MTorvald,RT ipeh HBS langsung ditahan untuk 20 hari kedepan HBD di jerat Pasal 14 ayat 1 UU RI Nomor 1 Tahun 1946 Pasal itu berbunyi
2022-01-04 09:26:23+00:00,Anak_Senja90,PPKM akan berlaku sepanjang 4 hingga 17 Januari mendatang Sejauh ini sudah tidak ada daerah yang menerapkan PPKM
2022-01-04 09:26:23+00:00,keonkhairul1,RT Pendiriannya itu mencetus tentangan daripada para pegawai Israel dan juga pujian daripada pengguna media sosial yang pro Pale
2022-01-04 09:26:22+00:00,JHaduw,Habib Bahar Bin Smith Dan Pengunggah Video Ceramah Resmi Jadi Tersangka Kasus Penyebaran Berita Bohong
2022-01-04 09:26:22+00:00,Anak_Senja90,23 persen atau 34 orang sudah sembuh dan sudah kembali ke rumah MulaiDariMasker
2022-01-04 09:26:21+00:00,Anak_Senja90,Sebanyak 34 dari 152 pasien Covid 19 yang terpapar varian Omicron sudah sembuh MulaiDariMasker
2022-01-04 09:26:18+00:00,Anak_Senja90,Kasus positif virus corona Covid 19 varian omicron di Indonesia mencapai 152 per hari ini Senin 3 2
2022-01-04 09:26:18+00:00,aimanrazib_,RT Tiada lagi walk in untuk dapatkan suntikan dos penggalak Protecthealth AWANInews AWANI745 Ha
2022-01-04 09:26:17+00:00,S0N_2000,RT Kinerja kepolisian dalam menangani kasus dugaan ujaran kebencian disorot publik
2022-01-04 09:26:16+00:00,Anak_Senja90,Kementerian Kesehatan menyatakan kasus positif Covid 19 varian omicron di Indonesia sudah lebih dari 150
2022-01-04 09:26:15+00:00,501Awani,Tangguh umrah Saya setuju tapi buat keputusan mengejut tidak kena Khalid AWANInews AWANI745
2022-01-04 09:26:11+00:00,republikaonline,Dalam beberapa tahun terakhir laporan kejahatan kebencian anti Muslim meningkat
2022-01-04 09:26:10+00:00,its_funnie,RT Erick Thohir bergabung bersama ribuan santri dan tokoh ulama Jawa Timur dalam istighosah bertajuk Doa Keselamatan untu
2022-01-04 09:26:09+00:00,HarutoGFisMe,MASUK BERITA PLSSS
2022-01-04 09:26:09+00:00,FixTv6,RT Pendiriannya itu mencetus tentangan daripada para pegawai Israel dan juga pujian daripada pengguna media sosial yang pro Pale
2022-01-04 09:26:06+00:00,Shaziera_Nadia,RT Jabatan Meteorologi Malaysia MetMalaysia mengeluarkan amaran hujan berterusan peringkat bahaya buruk dan waspada yang dija
2022-01-04 09:25:58+00:00,agama_nusantara,RT Cuci otak ala pesantren Seolah Kyai itu pasti suci dan benar Padahal yang cabul dan tukang perkosa murid jumlahnya
2022-01-04 09:25:56+00:00,tbgsem,RT Ahmad Faizal menyifatkan Cheng Hoe sebagai tokoh bola sepak tersohor serta berpengalaman luas AWANInews AWANI745
2022-01-04 09:25:46+00:00,wahyuyl,RT Pengacara Bahar Ichwan Tuankotta heran atas penetapan tersangka Habib Bahar Dia menilai proses penetapan tersangka itu sang
2022-01-04 09:25:41+00:00,amndaimi_,RT BHNasional Paras air laut yang tinggi sekali gus menjadi faktor berlaku banjir air pasang besar JPS
2022-01-04 09:25:41+00:00,detikcom,DPO teroris MIT Poso Sulteng Ahmad Panjang tewas ditembak Satgas Madago Raya Jenazahnya akan dimakamkan di area p
2022-01-04 09:25:37+00:00,Adi_8002,Gimana ini tukang ngibul Katanya dulu koar gak bakal ada PENGGUSURAN Ini buktinya ada penggusu
2022-01-04 09:25:36+00:00,iambillboyy,RT Selang beberapa hari selepas Leong Mun Yee umum persaraan dari sukan terjun kini giliran Cheong Jun Hoong pula ucap selam
2022-01-04 09:25:30+00:00,Tan2Id,RT Saya dilaporkan secepat kilat sedangkan masih ada penista penista Allah penista agama dilaporkan tidak diproses sama seka
2022-01-04 09:25:27+00:00,seruanhl,RT Menteri Badan Usaha Milik Negara BUMN Erick Thohir menghadiri istighosah di Pondok Pesantren Amanatul Ummah Kabupaten Mojo
2022-01-04 09:25:04+00:00,Riau1Official,ASN Beragama Islam di Lingkungan Pemprov Sumbar Wajib Absen Subuh
2022-01-04 09:25:02+00:00,Jaya93180022,RT Kinerja kepolisian dalam menangani kasus dugaan ujaran kebencian disorot publik
2022-01-04 09:25:00+00:00,yusufsimeon,RT Anies Baswedan bernostalgia dengan makan di sebuah warteg di kawasan Ancol Jakarta Utara Anies makan di warteg yang fotonya
2022-01-04 09:24:58+00:00,zahid_zulkeffli,RT BERITA TERKINI Ada perempuan feminist panggil Allah SWT dengan ganti nama She bukan He Ini dah cukup melampau kera
2022-01-04 09:24:57+00:00,jabarekspres,Nashrudin Azis Bidik Kursi DPR RI Usai jadi Wali Kota Cirebon
2022-01-04 09:24:55+00:00,dislan09,RT Salah satu pasal yg menjerat HBS yaitu penyebaran berita bohong apa kabar Jokowi Apa Kabar Ma ruf amin Kurang bohonga apa
2022-01-04 09:24:55+00:00,BrotherAdr1an,RT KKM siasat laporan 18 kes AEFI melalui program vaksinasi banduan penjara Kajang Berita penuh http
2022-01-04 09:24:54+00:00,TanteBokep6,breaking news analysis exclusive interviews headlines and videos at berita cerita threa
2022-01-04 09:24:51+00:00,tbgsem,RT Malaysia Taklimat Local General Coordinator LGC MPFL 2022 4 Januari 2022 Baca berita penuh di FA
2022-01-04 09:24:50+00:00,andyydepp,RT Kasus Denny Siregar di Polda Jabar sudah berjalan lebih dari satu tahun
2022-01-04 09:24:47+00:00,aseep23,RT nago Banjir Kembali Landa Calon Ibu Kota Baru RI
2022-01-04 09:24:45+00:00,callmekaayyy_,biasa analisis berita bisa wa ya wa on bio
2022-01-04 09:24:43+00:00,itsfreeyaa,Kirain dia mau ngabarin lagu vibration diputer di mana gt atau ada berita bakal rilis lagu eh taunya
2022-01-04 09:24:42+00:00,alvinpermen,INI OPERATOR TRI SANGAT SANGAT MENGGANGGU DENGAN PENGIRIMAN BERITA JI
2022-01-04 09:24:41+00:00,dorseysilalahi,RT Tuh baca sejarahnya gelar habib di Indonesia Ga ada hubungannya sama keturunan Nabi tapi keturunan Alwi bin ubaidil
2022-01-04 09:24:40+00:00,Nova88Indo,Berita Bola Terkini Nova88 Indonesia Klik Situasi Lukaku Usai Bicara dengan Tuchel Aman
2022-01-04 09:24:37+00:00,antaranews,Gaga Muhammad dituntut hukuman penjara 4 6 tahun dan denda sebesar Rp10 juta JPU juga meminta SIM A milik Gaga unt
2022-01-04 09:24:36+00:00,kompascom,Polisi telah menahan Bahar bin Smith dan ditetapkan tersangka kasus penyebaran berita bohong saat ceramah di Kabupa
2022-01-04 09:24:35+00:00,dalbo_27,Dania akbar viv4l Wicaksana2 Kenapa ya ber
2022-01-04 09:24:22+00:00,user_ga_ramah,RT Sehari Setelah Divaksin Siswa MI di Magetan Meninggal Dunia
2022-01-04 09:24:22+00:00,arnamee,RT Tiada lagi walk in untuk dapatkan suntikan dos penggalak Protecthealth AWANInews AWANI745 Ha
2022-01-04 09:24:20+00:00,GOAL_ID,Irfan Jauhari antusias mencicipi Liga 1 dengan membela klub sebesar Persija Jakarta Persija Liga1
2022-01-04 09:24:16+00:00,naadsiy,RT Mahasiswa UGM Raih Juara I Lomba Debat Bahasa Nasional
2022-01-04 09:24:05+00:00,enjel02hebeun,RT Erick Thohir bergabung bersama ribuan santri dan tokoh ulama Jawa Timur dalam istighosah bertajuk Doa Keselamatan untu
2022-01-04 09:23:59+00:00,rhawinng,RT IPW menilai Polda Jabar perlu mencopot penyidik kasus kasus yang mangkrak
2022-01-04 09:23:58+00:00,Garbageilo,RT Ahli Pastikan 6 Laskar FPI Korban Unlawful Killing Tewas Tertembak
2022-01-04 09:23:55+00:00,HeriFerdinand5,RT Sehari Setelah Divaksin Siswa MI di Magetan Meninggal Dunia
2022-01-04 09:23:54+00:00,rizkifrifai,RT Kinerja kepolisian dalam menangani kasus dugaan ujaran kebencian disorot publik
2022-01-04 09:23:54+00:00,A_The_lion_27,diy Sidak itu enak puluh
2022-01-04 09:23:52+00:00,cacin666,RT ID Tak cuma solid bek Jerman itu juga tak ragu untuk mengganggu lawan lewat psywar maupun tindakan tindakan usil Chelsea Liv
2022-01-04 09:23:50+00:00,sadnessagainn,mempelajari bahasa inggris menggunakan rumus adalah cara agar bisa berbahasa inggris dengan baik dan benar namun
2022-01-04 09:23:50+00:00,rashdanmarzuki,RT Spekulasi tiga menteri bakal gugurkan daripada senarai jemaah kabinet sedang bertiup kencang ketika ini
2022-01-04 09:23:50+00:00,BernamaTV,Banjir Perlis perlu ambil iktibar rancang pembangunan negeri Berita penuh
2022-01-04 09:23:45+00:00,Kentomiyauraaa,Ok Ternyata dimana mana ada aja berita ga enak soal organisasi olahraga
2022-01-04 09:23:37+00:00,bengklmahaputra,Bajaj Husqvarna akan mulai produksi motor listrik di Juni nanti Perkembangan teknologi dan era kendaraan listrik
2022-01-04 09:23:35+00:00,PARTOWIJOYO69,RT nah jadi memang kita tidak publikasi karena sifatnya projustitia dan hanya bisa digunakan saat proses di pengadilan
2022-01-04 09:23:34+00:00,wahyuyl,RT Mantaaaap Bahar masoook lagiii
2022-01-04 09:23:32+00:00,nightskymir,RT Siasatan ni pun tak settle lagi
2022-01-04 09:23:28+00:00,jokohand76,RT Kinerja kepolisian dalam menangani kasus dugaan ujaran kebencian disorot publik
2022-01-04 09:23:26+00:00,JackBoea2,RT Polda Jabar harus profesional dan adil dalam memproses kasus pidana yang ditangani
2022-01-04 09:23:26+00:00,_juliyana,RT alsiddiqiy Berita baik Ada dermawan sponsor dua buah kitab Syarah Aqidah Imam Al Nawawi Justeru saya nak buat giveaway dua na
2022-01-04 09:23:21+00:00,faatmarazola,RT Kalo kritik yg ono pasukannya lsg bikin berita di portal gak jelas abis itu diposting di akun ig nya yg gak jelas juga
2022-01-04 09:23:17+00:00,jabarekspres,Bupati Bandung Pengabdian Tel U ke Masyarakat Jadi Contoh Kampus Lain
2022-01-04 09:23:13+00:00,barkode46,Blm kesana lg tuh terakhir ada berita sih lg rame ada 2 anak singa yg baru lahir
2022-01-04 09:23:07+00:00,kanaljatengcom,Bahar bin Smith Tersangka Kasus Penyebaran Berita Bohong dari Ceramah di Margaasih Bandung
2022-01-04 09:23:05+00:00,_aixfir_,RT Pendiriannya itu mencetus tentangan daripada para pegawai Israel dan juga pujian daripada pengguna media sosial yang pro Pale
2022-01-04 09:23:04+00:00,KATADATAcoid,Kasus Covid 19 varian Omicron mencetak rekor di AS Ribuan sekolah di Negeri Paman Sam itu pun menunda pembukaan pe
2022-01-04 09:23:02+00:00,NorKamarulAzman,RT Kerja pembaikan oleh DBKL dijangka mengambil masa dua atau tiga hari AWANInews AWANI745 Banjir2021
2022-01-04 09:22:56+00:00,republikaonline,Dalam reforma agraria pemerintah baru melampaui target dalam hal legalisasi aset
2022-01-04 09:22:55+00:00,kuasakatacom,IDI Usul Jepara Bangun RSJ Bupati Andi Minta DKK Lakukan Kajian
2022-01-04 09:22:45+00:00,kitaindonesiaaa,RT Ceramah menuduh Polri membunuh 6 FPI pengawal Rizieq Difitnah dgn keji dgn kata Dibunuh disiksa dikuliti dicabut k
2022-01-04 09:22:28+00:00,i_rabb,RT Pendiriannya itu mencetus tentangan daripada para pegawai Israel dan juga pujian daripada pengguna media sosial yang pro Pale
2022-01-04 09:22:25+00:00,aldinrenaldi16,RT Saya dilaporkan secepat kilat sedangkan masih ada penista penista Allah penista agama dilaporkan tidak diproses sama seka
2022-01-04 09:22:24+00:00,iskandarhelmi47,Tutup Posko Nataru Menhub Penanganan Pergerakan Transportasi Berjalan Lancar Dengan Prokes Ketat
2022-01-04 09:22:19+00:00,seruanhl,RT Menteri BUMN Erick Thohir menghadiri istighosah di Pondok Pesantren Amanatul Ummah Mojokerto Jatim Kedatangan Erick disambut
2022-01-04 09:22:13+00:00,hgberry,RT Yg paling lucu dari ini semua Bahar dateng dgn jumawa dan PD bak pahlawan dikawal ratusan orang pengacara juga sdh
2022-01-04 09:22:08+00:00,rikzareznor,Gue sih egri with your opiniyen kek litrali banyak banget yuser y
2022-01-04 09:22:04+00:00,republikaonline,Hoaks Bahar terkait ceramah di Margaasih Kabupaten Bandung pada 11 Desember 2021
2022-01-04 09:22:03+00:00,antarabiz,SKK Migas yakin Rokan kembali jadi produsen minyak terbesar di 2022
2022-01-04 09:22:03+00:00,Noviyanti1207,RT mengajak para santri untuk siap mengembangkan diri secara mandiri dengan membentuk perekonomian kreatif ata
2022-01-04 09:22:03+00:00,LyzzaCruzz,RT Wahai peniaga tolong dengar nasihat Dr Noor Hisham henti bungkus nasi guna paku dawai kokot
2022-01-04 09:22:02+00:00,501Awani,Ahmad Faizal menyifatkan Cheng Hoe sebagai tokoh bola sepak tersohor serta berpengalaman luas AWANInews AWANI745
2022-01-04 09:22:02+00:00,faridimran1,RT BERITA TERKINI Ada perempuan feminist panggil Allah SWT dengan ganti nama She bukan He Ini dah cukup melampau kera
2022-01-04 09:22:00+00:00,ANTARABengkulu,Pemimpin Hong Kong bantah kebebasan pers di ambang kepunahan ANTARA News Bengkulu
2022-01-04 09:22:00+00:00,antaramakassar,Kelompok milenial mengapresiasi Polri cepat atasi pelaku intoleran
2022-01-04 09:21:56+00:00,berita_diy,Bacaan Doa Mohon Perlindungan Keselamatan dari Bahaya dalam Perjalanan Bagi Keluarga dan Artinya DOA
2022-01-04 09:21:56+00:00,khairulirfn,RT Ratusan kenderaan dilihat berhenti di jalan raya ketika orang ramai mahu menikmati cuaca luar biasa di kawasan berdekatan sem
2022-01-04 09:21:55+00:00,teodomina,Wingi moco berita ttg kremasi akuamasi uskup juga langsung kelingan deknen
2022-01-04 09:21:48+00:00,aidil_axlan,RT Jika Satelit jatuh di atas rumah tanah anda undang undang angkasa akan melindungi anda Pernah tak kita tengok di berita a
2022-01-04 09:21:47+00:00,asjeplak,Agen Tegaskan Christian Eriksen Akan Membuka Suara Terkait Kelanjutan Kariernya
2022-01-04 09:21:44+00:00,Ronin708103553,RT Ceramah menuduh Polri membunuh 6 FPI pengawal Rizieq Difitnah dgn keji dgn kata Dibunuh disiksa dikuliti dicabut k
2022-01-04 09:21:42+00:00,otodriver,Mercedes Benz Vision EQXX Melakukan Debutnya Setelah Batal Melantai Di CES 2022 Setelah batal melantai di ajang Co
2022-01-04 09:21:40+00:00,karlwickk,RT Banjir Johor Satu PPS di Tangkak ditutup jumlah mangsa banjir meningkat AWANInews AWANI745
2022-01-04 09:21:30+00:00,ANTARABengkulu,Emma Watson suarakan dukungan untuk Palestina ANTARA News Bengkulu
2022-01-04 09:21:29+00:00,perangutan_,RT Saya dilaporkan secepat kilat sedangkan masih ada penista penista Allah penista agama dilaporkan tidak diproses sama seka
2022-01-04 09:21:29+00:00,syafiqahnrl,RT Pendiriannya itu mencetus tentangan daripada para pegawai Israel dan juga pujian daripada pengguna media sosial yang pro Pale
2022-01-04 09:21:26+00:00,NiinaAzath,RT Peperiksaan percubaan cerminan sebenar SPM Berita Harian Prof Dr Ismi Arif Ismail Fakulti Pengajian Pendidikan U
2022-01-04 09:21:19+00:00,wahyuyl,RT Mereka akan bilang ini Kriminalisasi ulama Tapi kata HabibZen Anda itu nyembah Nasab anda dudukkan Nasab itu diatas
2022-01-04 09:21:18+00:00,antaramakassar,Polisi belum beberkan isi hoaks Bahar Smith
2022-01-04 09:21:17+00:00,AaDeank,Berita yg SANGAT BERMUTU DAN SANGAT BERMANFAAT dunia akhirat
2022-01-04 09:21:15+00:00,majoritionline,Wakt waktu begini eloknya fokus kepentingan rakyat je majoriti primer IsmailSabri kabinet
2022-01-04 09:21:10+00:00,itskemboja,RT yang masuk berita haritu ke
2022-01-04 09:21:08+00:00,twtnvm,RT Siasatan ni pun tak settle lagi
2022-01-04 09:21:03+00:00,aijattttt_,RT Pendiriannya itu mencetus tentangan daripada para pegawai Israel dan juga pujian daripada pengguna media sosial yang pro Pale
2022-01-04 09:21:00+00:00,antaranews,Keempat tersangka baru yang dibekuk oleh polisi diduga turut berperan menggunakan aplikasi perpesanan dan kemudian
2022-01-04 09:20:55+00:00,imkiddobtw_,RT Pendiriannya itu mencetus tentangan daripada para pegawai Israel dan juga pujian daripada pengguna media sosial yang pro Pale
2022-01-04 09:20:53+00:00,MediaCenter_TMG,Jumlah Kejadian Kebakaran di Temanggung Turun Selama Pandemi Selengkapnya
2022-01-04 09:20:51+00:00,goyodbod,RT blues 1 Vaksinasi booster covid 19 di Indonesia akan dimulai pada tgl 12 Januari 2022 dan diberikan hanya utk orang dewasa di
2022-01-04 09:20:49+00:00,dowuchsaa,ini baru ga buka twitter sehari aja udah ada berita apalagi sih
2022-01-04 09:20:49+00:00,AkekHera,dumdum Bener ya berita ini kalau bener keren tuh semua yg mundur partai Ketum
2022-01-04 09:20:48+00:00,AfiqAhlami,RT Pendiriannya itu mencetus tentangan daripada para pegawai Israel dan juga pujian daripada pengguna media sosial yang pro Pale
2022-01-04 09:20:47+00:00,fikaosman,RT Indonesia mencatat sebanyak 299 kasus baru COVID 19 Selasa 4 1 2022 DKI menyumbang kasus terbanyak dengan jumlah 115
2022-01-04 09:20:46+00:00,asjeplak,Kemendikbudristek Bongkar Dampak Negatif Pandemi pada Dunia Pendidikan
2022-01-04 09:20:45+00:00,jxy_g01,RT Sedikit meningkat berbanding semalam AWANInews AWANI745
2022-01-04 09:20:42+00:00,KominfoSidrap,Kebakaran menghanguskan satu unit rumah di Lingkungan II Kelurahan Salomallori Kecamatan Duapitue Selasa 4 1 202
2022-01-04 09:20:39+00:00,MantanProfessor,RT ali7 Habib Bahar ditahan mudah diprediksi jaga Jempol kalian ya sob rezim ini Tanpa saya harus jelaskan panjang lebar ka
2022-01-04 09:20:36+00:00,antaramakassar,Bek Chelsea Antonio Rudiger jadi incaran klub besar Eropa
2022-01-04 09:20:33+00:00,epankhai,RT Tiada lagi walk in untuk dapatkan suntikan dos penggalak Protecthealth AWANInews AWANI745 Ha
2022-01-04 09:20:32+00:00,bm_ismail,RT Kinerja kepolisian dalam menangani kasus dugaan ujaran kebencian disorot publik
2022-01-04 09:20:28+00:00,CoolSadoet,Provosal numpuk di meja tinggal pilih penghargaan apakah yang mau Acara makan makan di tanggung pem
2022-01-04 09:20:24+00:00,luqmankhusairi,RT BERITA TERKINI Ada perempuan feminist panggil Allah SWT dengan ganti nama She bukan He Ini dah cukup melampau kera
2022-01-04 09:20:24+00:00,Iam_Zaril,RT Menurut Ismail Sabri fokus utama kerajaan ketika ini adalah untuk mempercepatkan bantuan kepada mangsa yang terjejas dengan
2022-01-04 09:20:22+00:00,exomalaysia_,Saya hormati keputusan Cheng Hoe Ahmad Faizal Saya hormati keputusan Tan Che
2022-01-04 09:20:19+00:00,Iam_Zaril,RT Saman difailkan pengundi itu membabitkan Langkah Sheraton AWANInews AWANI745
2022-01-04 09:20:17+00:00,abinandos_,Billkin adalah tempat pulang paling nyaman tiap ada berita yg bikin mata sakit tiap baca nya aku sayang bbillkin
2022-01-04 09:20:17+00:00,detikcom,Indonesia mencatat sebanyak 299 kasus baru COVID 19 Selasa 4 1 2022 DKI menyumbang kasus terbanyak dengan jumla
2022-01-04 09:20:17+00:00,detikHealth,Indonesia mencatat sebanyak 299 kasus baru COVID 19 Selasa 4 1 2022 DKI menyumbang kasus terbanyak dengan jumla
2022-01-04 09:20:11+00:00,Ryankrsjynti,berharap setiap harinya akan ada berita baik
2022-01-04 09:20:11+00:00,Jokitugaskuuu1,Hmuu kak 25k berita Wa ada di bio
2022-01-04 09:20:08+00:00,moharyz,RT Berita TanahMendap Polis tutup Jalan Kinabalu dari arah Cheras
2022-01-04 09:20:07+00:00,tvOneNews,Polisi Belum Bisa Beberkan Isi Hoaks Bahar Smith
2022-01-04 09:20:06+00:00,tvOneNews,Dokter yang Mengaku Bisa Netralkan Darah Pecandu Narkoba di Cianjur Pasang Tarif Rp 10 Juta Sekali Suntik
2022-01-04 09:20:02+00:00,EkoArrahman2,Saya itu merasa ngerii jika membaca berita tentang Korban Begal melawan sampai membunuh begal Eeeeh di hukum Penj
2022-01-04 09:19:59+00:00,Amaygedeng,RT blues 1 Vaksinasi booster covid 19 di Indonesia akan dimulai pada tgl 12 Januari 2022 dan diberikan hanya utk orang dewasa di
2022-01-04 09:19:58+00:00,koohaelo,liat berita cnn jdi keinget cloy apakabs kapten ri
2022-01-04 09:19:57+00:00,RedywanJ,RT ferry Menyelesaikan masalah dengan meninggalkan masalah baru Tanggung jawab siapa Pemprov DKI atau Kontraktor Sumur Resapan
2022-01-04 09:19:56+00:00,AbdulAzizlatte,RT Ya ampun ini ada lagi Ortu ikhlas dan tidak akan menuntut pemerintah StopPaksaVaksinAnakC19 StopPaksaVaksin
2022-01-04 09:19:55+00:00,antaramakassar,Lima negara sepakati perjanjian antinuklir China dorong Indonesia bersuara
2022-01-04 09:19:54+00:00,SinarOnline,Siti Nur Alia Mansor cipta sejarah tersendiri apabila menjadi pelumba wanita pertama negara dan Asia Tenggara terpi
2022-01-04 09:19:43+00:00,voidotid,Dalam kasus Bahar penyidik Polda Jabar hanya membutuhkan waktu 17 hari saja mulai dari pelaporan pemeriksaan hin
2022-01-04 09:19:42+00:00,Barokahaamiin,RT Pertamina Hulu Rokan akan mengebor dua sumur eksplorasi untuk memburu cadangan migas nonkonvensional di Blok Rokan http
2022-01-04 09:19:40+00:00,nganemtruzla,Menurut Brigitta yang beredar eh berita maksudnya
2022-01-04 09:19:30+00:00,republikaonline,Kemenag Pelaksanaan Umroh Tetap Berlanjut
2022-01-04 09:19:21+00:00,__nisx,RT Tiada lagi walk in untuk dapatkan suntikan dos penggalak Protecthealth AWANInews AWANI745 Ha
2022-01-04 09:19:19+00:00,puputalviani,yawla anak gw masup berita
2022-01-04 09:19:17+00:00,sayyidsafari,RT BERITA TERKINI Ada perempuan feminist panggil Allah SWT dengan ganti nama She bukan He Ini dah cukup melampau kera
2022-01-04 09:19:14+00:00,jawapos,Pemkab Ponorogo Fokuskan Vaksinasi Lansia
2022-01-04 09:19:08+00:00,antaramakassar,BNPT Kelompok radikal dan teroris berkarakter antikearifan lokal keagamaan
2022-01-04 09:19:04+00:00,voidotid,Semua orang tua perlu baca supaya tahu dan nyaman ketika melepas anak anaknya pergi ke sekolah
2022-01-04 09:19:02+00:00,Nurizal,RT Eks CEO Bukalapak Rachmat Kaimuddin resmi bergabung dengan Kemenko Kemaritiman dan Investasi pimpinan Luhut Binsar Pandja
2022-01-04 09:18:52+00:00,voidotid,Polri menyebut ada dua alasan penyidik Polda Jawa Barat menahan Bahar bin Smith dan TR di kasus dugaan ujaran keben
2022-01-04 09:18:50+00:00,frhanrzn,RT Berita gembira untuk pengumpul topi Lepasni dah boleh cuci topi korang guna cover topi ni and campak dalam washin
2022-01-04 09:18:49+00:00,prince_Azhim123,RT Ceramah menuduh Polri membunuh 6 FPI pengawal Rizieq Difitnah dgn keji dgn kata Dibunuh disiksa dikuliti dicabut k
2022-01-04 09:18:48+00:00,mulya_tjan,RT ombak Nanti lanjutkan cipika cipiki dgn tahanan lain ya drunn PUAS gue Polda Jabar menetapka
2022-01-04 09:18:46+00:00,Healme07,RT Pendiriannya itu mencetus tentangan daripada para pegawai Israel dan juga pujian daripada pengguna media sosial yang pro Pale
2022-01-04 09:18:39+00:00,basejasatugas,Jasa Butuh yg bisa kerjain artikel berita 3 halaman DL jam 10 malam ini Plagiasi max 30 Sumber sudah ada Buat
2022-01-04 09:18:36+00:00,andyydepp,RT Ahli Pastikan 6 Laskar FPI Korban Unlawful Killing Tewas Tertembak
2022-01-04 09:18:35+00:00,Hasan81114197,Pengikut dunggu ga tau berita ya
2022-01-04 09:18:26+00:00,detikcom,Indonesia melaporkan 299 kasus COVID 19 pada Selasa 4 1 2022 Total kasus positif menjadi 4 263 732 sembuh 4 114
2022-01-04 09:18:25+00:00,C_Firman07,RT Code gais mau nanya dong ada yg tau ga nyari dataset berita indonesia dimana yaa
2022-01-04 09:18:23+00:00,KATADATAcoid,Pertamina Hulu Rokan akan mengebor dua sumur eksplorasi untuk memburu cadangan migas nonkonvensional di Blok Rokan
2022-01-04 09:18:17+00:00,meogudon,RT id Dispatch rilis foto pesepakbola HwangUiJoo dan Hyomin T ARA tengah berlibur ke Swiss Keduanya telah mengonfirmasi b
