waktu,username,text2022-01-04 09:09:27+00:00,apajabolehdagh,jujur dari awal denger berita pemain independen bakal tetep maju tuh udah ketar ketir banget perasaan
2022-01-04 09:09:27+00:00,lohjeni,RT Jakarta kini kembali ke PPKM level 2 setelah sebelumnya sempat berada di level 1 Apa penyebab Jakarta kembali ke level 2 ht
2022-01-04 09:09:23+00:00,Ondoishere,ri Yuk hari senin pertama semangat yuk awali hari dengan membaca berita update dari bp2mi
2022-01-04 09:09:22+00:00,detikfinance,Kementerian Perdagangan mengungkap saat ini harga telur ayam sudah turun dari tertinggi Rp 32 000 per kilogram menj
2022-01-04 09:09:15+00:00,berita_gempa,Jika engkau menjadi penolong kepada hati yang hancur maka mata air kebijaksanaan akan mengalir dari hatimu Maul
2022-01-04 09:09:11+00:00,BaidlowiDodo,Ente ini makin lama makin kocak bang bukan cuma lucu
2022-01-04 09:09:06+00:00,Arenanews1,Hasil NBA 2021 2022 Warriors Padamkan Heat Bucks Ditembak Pistons SINDOnews Google Berita Sports
2022-01-04 09:09:05+00:00,NorAkmal_Z,RT Terima panggilan telefon daripada individu tak dikenali yang mendakwa dari jabatan kerajaan atau institusi kewangan Jangan c
2022-01-04 09:09:02+00:00,Arenanews1,Axelsen Tunjukkan Suasana Padepokan Dubai Kewalahan Saat Sparring INDOSPORT Google Berita Sports
2022-01-04 09:09:00+00:00,GustiMberkahi,RT Memasuki tahun terakhir masa bakti dia akan banyak melakukan langkah seperti ini Perlu utk bernostalgia amp membangkitk
2022-01-04 09:09:00+00:00,opsiin,Hasil NBA 2021 2022 Warriors Padamkan Heat Bucks Ditembak Pistons SINDOnews Google Berita Sports Arenanews
2022-01-04 09:08:59+00:00,opsiin,Kasuwar yan kwallo Makomar Rudiger Botman Trippier Christensen Barbosa Maitland Niles Google Berita Sports
2022-01-04 09:08:59+00:00,opsiin,Axelsen Tunjukkan Suasana Padepokan Dubai Kewalahan Saat Sparring INDOSPORT Google Berita Sports Arenanews
2022-01-04 09:08:59+00:00,Ondoishere,RT ri Semangat hari Senin ya SobatMigran Pagi ini jangan lupa untuk baca berita ter update rangkuman BP2MI selama sepekan BP2
2022-01-04 09:08:58+00:00,opsiin,Ini 6 Fakta Setelah MU Ditumbangkan Wolves di Kandang Sendiri Google Berita Sports Ar
2022-01-04 09:08:56+00:00,GustiMberkahi,RT Ternyata sumur resapan DKI masih meninggalkan mslh kupikir sdh selesai pdhal hanya tinggal membersihkan sisa2 proyek hrs n
2022-01-04 09:08:56+00:00,Syamsud76579252,RT Beberapa proyek strategis di 2022 telah memasuki masa akhir untuk segera diresmikan
2022-01-04 09:08:54+00:00,selflove_ifa,RT HAIII SEMUAA ADA BERITA GEMBIRA BATH amp BODY WORKS BUAT SALE 75 OFF jomm joinnn PS ira cas RM2 sahaja body mist
2022-01-04 09:08:53+00:00,ayudyaay28,RT Cuci otak ala pesantren Seolah Kyai itu pasti suci dan benar Padahal yang cabul dan tukang perkosa murid jumlahnya
2022-01-04 09:08:52+00:00,Arenanews1,Ini 6 Fakta Setelah MU Ditumbangkan Wolves di Kandang Sendiri Google Berita Sports
2022-01-04 09:08:46+00:00,jawapos,Kafe Menyatu dengan Penerbitan Buku
2022-01-04 09:08:46+00:00,haziqrazak92,RT Pendiriannya itu mencetus tentangan daripada para pegawai Israel dan juga pujian daripada pengguna media sosial yang pro Pale
2022-01-04 09:08:42+00:00,blackpigeon123,RT Sah ketinggalan tak baca berita
2022-01-04 09:08:40+00:00,Syamsud76579252,RT JPU mengambil keterangan terdakwa Herry Wirawan dalam sidang hari ini
2022-01-04 09:08:38+00:00,lampostco,Legislatif mendesak Pemerintah Kabupaten Pemkab Lampung Selatan segera memperbaiki jalan poros di Kecamatan Sidom
2022-01-04 09:08:36+00:00,VIVAcoid,Perusahaan Ini Daur Ulang Ampas Kopi Jadi Sepatu
2022-01-04 09:08:36+00:00,achrizqi,Nah semoga gk masuk berita hoak
2022-01-04 09:08:33+00:00,aaxxelee_,Hay kak Sebenernya ini berita dah dapet ditahun 2021 ada kasus Jnt juga nah kurirnya nih ng
2022-01-04 09:08:32+00:00,antarabiz,Kemenhub catat peningkatan jumlah penumpang angkutan umum 10 71 persen
2022-01-04 09:08:31+00:00,kuroelf,Itu berita pas Kohend mau masuk pelatnas lagi di 2018 btw jadi posisinya Ahsan emang masih di pelatnas
2022-01-04 09:08:26+00:00,publicanews,KPK Cegah Eks Dirjen Bina Keuda Kemendagri Ardian Noervianto
2022-01-04 09:08:23+00:00,sikineyy,RT Kinerja kepolisian dalam menangani kasus dugaan ujaran kebencian disorot publik
2022-01-04 09:08:19+00:00,jabarekspres,Antisipasi Omicron RSUD Otista Sediakan Delapan Ruang Isolasi
2022-01-04 09:08:14+00:00,publicanews,Berkas Perkara Dua Tersangka Kasus Korupsi di PG Djatiroto Telah P21
2022-01-04 09:08:10+00:00,dayofjune13,Jarang bgt aku ngepost di feed setahun lalu cuma 10 foto igs pun jarang Pengen deactivated tp fom
2022-01-04 09:08:04+00:00,rowanromano,RT Berita banjir negara kita sudah masuk CNN Adakah kerajaan gagal ni akan berasa segan atau malu DaruratBanjir KerajaanGa
2022-01-04 09:08:02+00:00,BJKT2Terpercaya,Sobat BUMN BUMN FLASH NEWS di Episode ke 32 kembali menghadirkan informasi 7 berita amp produk BUMN terbaik dia
2022-01-04 09:08:02+00:00,KristalNeo,RT Bukti rumah DP 0 rupiah tidak bisa dinikmati warga miskin Anies Ngibul Neno ngibul Panji ngibul
2022-01-04 09:08:02+00:00,myluvr_jiwoo,RT Pendiriannya itu mencetus tentangan daripada para pegawai Israel dan juga pujian daripada pengguna media sosial yang pro Pale
2022-01-04 09:08:00+00:00,sobarsururi,RT Kinerja kepolisian dalam menangani kasus dugaan ujaran kebencian disorot publik
2022-01-04 09:08:00+00:00,agungs76,Depok bpn Seperti yg sudah
2022-01-04 09:07:59+00:00,rowanromano,RT Ramai jugak yg bodoh kat sini Sapa kata tiap kali bencana kena keluar kwsp Bezanya kali ni ialah banjir berlaku masa dlm
2022-01-04 09:07:59+00:00,autoWINN,Nunggu film the moon dibicarain di berita amerika dan eropa
2022-01-04 09:07:50+00:00,publicanews,Jaksa Hadirkan Dua Kepala Daerah dalam Sidang Azis Syamsuddin
2022-01-04 09:07:46+00:00,JHaduw,Habib Bahar Bin Smith Dan Pengunggah Video Ceramah Resmi Jadi Tersangka Kasus Penyebaran Berita Bohong
2022-01-04 09:07:38+00:00,publicanews,Dua Eks Pejabat PT Waskita Karya Diperiksa untuk Bos Adi Wibowo
2022-01-04 09:07:35+00:00,yuris_man,RT Polda Jabar dinilai menerapkan standar ganda penanganan kasus ujaran kebencian
2022-01-04 09:07:34+00:00,diva_acm,RT Berita DT hari ini Berikut informasi baru seputar Program Daarut Tauhiid untuk mengetahui informasi terbaru dari Da
2022-01-04 09:07:28+00:00,aysazh,Siasatan ni pun tak settle lagi
2022-01-04 09:07:27+00:00,AnwarFadzil,RT Sudah diarah henti namun masih diteruskan juga Siapa agaknya orang di sebaliknya AWANInews AWANI745
2022-01-04 09:07:25+00:00,muhyee98,RT alsiddiqiy Berita baik Ada dermawan sponsor dua buah kitab Syarah Aqidah Imam Al Nawawi Justeru saya nak buat giveaway dua na
2022-01-04 09:07:24+00:00,republikaonline,Bahar ditahan karena penyidik takut tersangka menghilangkan barang bukti
2022-01-04 09:07:21+00:00,JHaduw,Habib Bahar Bin Smith Dan Pengunggah Video Ceramah Resmi Jadi Tersangka Kasus Penyebaran Berita Bohong
2022-01-04 09:07:19+00:00,HasanZamzuri,RT Saya ni Menteri kampung jadi apa pun tetap orang kampung
2022-01-04 09:07:18+00:00,fatboycanrun,rahmann Dah settle kan
2022-01-04 09:07:17+00:00,galang_khoirul,RT MagelangMigunani berita kehilangan monggo teman sekiranya ada yg menemukan mohon hubungi nomer tertera cc
2022-01-04 09:07:16+00:00,publicanews,KPK Ingatkan Saksi Kasus Bupati HSU Kooperatif
2022-01-04 09:07:15+00:00,gubernurkoplak,RT Om lizal lamli jgn pingsan ya baca berita ini
2022-01-04 09:07:12+00:00,yuris_man,RT Kinerja kepolisian dalam menangani kasus dugaan ujaran kebencian disorot publik
2022-01-04 09:07:08+00:00,dabenone2,RT Anggaran Riset 2014 10T 2015 17T 2016 30 8T 24 7T pemer
2022-01-04 09:07:08+00:00,antaralampung,Polisi ringkus empat tersangka baru kasus asusila anak
2022-01-04 09:07:07+00:00,Cantika00699425,RT Akhirnya pemecah belah bangsa di tahan juga Betapa leganya mendengar beritanya semua bahagia
2022-01-04 09:07:07+00:00,syakirhmz,RT Pendiriannya itu mencetus tentangan daripada para pegawai Israel dan juga pujian daripada pengguna media sosial yang pro Pale
2022-01-04 09:07:06+00:00,Aryaadi67273603,RT Kinerja kepolisian dalam menangani kasus dugaan ujaran kebencian disorot publik
2022-01-04 09:07:04+00:00,publicanews,Eks Sekjen Kemendagri Dikonfirmasi Kerugian Negara di Kampus IPDN Sulut
2022-01-04 09:07:04+00:00,YRuhiyat3,RT Boneka itu mainan atau hoby itu boleh aja Tapi klo dijadikan demit arwah atau diisi arwah makhluk halus dan jin itu haram
2022-01-04 09:06:57+00:00,jenggotja,RT Tahun baru disambut berita duka dari Liga 3 Pemalang Usut dong jangan melulu timnas dan prestasi piala medioker aja yang
2022-01-04 09:06:55+00:00,beritamanado,Berita terbaru Komsos Babinsa Bersama Tokoh Angin Kencang Banjir Bandang Komsos Babinsa
2022-01-04 09:06:52+00:00,otnayramitsme,RT prabu Yaahh gak rame lagi dong Film y Jacuzian y pindah deh jadi JakPro Jacuzi Prodeo
2022-01-04 09:06:51+00:00,publicanews,Berkas Tersangka Korporasi PT Nindya Karya Dinyatakan Lengkap
2022-01-04 09:06:47+00:00,beritartm,4 Januari Tangguh ibadah umrah gambaran sebenar risiko COVID 19 dibincangkan dalam mesyuarat khas kabinet esok
2022-01-04 09:06:42+00:00,mulanbilqis,RT Menteri Badan Usaha Milik Negara BUMN Erick Thohir menghadiri istighosah di Pondok Pesantren Amanatul Ummah Kabupaten Mojo
2022-01-04 09:06:41+00:00,programmer_tua,RT sajak Kesian yah Demi JIS mereka kena gusur Amies Bausetan
2022-01-04 09:06:41+00:00,Jackjackaljugja,RT Kinerja kepolisian dalam menangani kasus dugaan ujaran kebencian disorot publik
2022-01-04 09:06:38+00:00,prabutintaemas,RT Bahar Smith Ditetapkan Jadi Tersangka Kuasa Hukum Kami Menduga Ada Sponsor Dibelakang Semua Ini
2022-01-04 09:06:35+00:00,publicanews,Pejabat Pemeriksa Pajak Wawan Ridwan JugaTersangka Pencucian Uang
2022-01-04 09:06:32+00:00,sirtlmstqm,RT Kabid Humas Polda Jawa Barat Kombes Pol Ibrahim Tompo memastikan Bahar Smith BS telah ditahan di Rumah Tahanan Rutan Po
2022-01-04 09:06:28+00:00,ludfikapten,RT Kinerja kepolisian dalam menangani kasus dugaan ujaran kebencian disorot publik
2022-01-04 09:06:28+00:00,KevinBTS,RT Apa yang pantas untuk yang mati nurani nya melihat korban Vaksin yang lebih bahaya dari penyakit nya sendiri
2022-01-04 09:06:25+00:00,firelilswan,KAGET BANGED LIAT BERITA KEMATIANNYA
2022-01-04 09:06:25+00:00,republikaonline,JPU mengambil keterangan terdakwa Herry Wirawan dalam sidang hari ini
2022-01-04 09:06:23+00:00,Kang_DT,RT Ahli Pastikan 6 Laskar FPI Korban Unlawful Killing Tewas Tertembak
2022-01-04 09:06:22+00:00,Generasi_2000,RT Banjir Rendam 14 Kecamatan di Aceh Utara Ya Allah
2022-01-04 09:06:22+00:00,republikaonline,Ada enam kabupaten di Jatim yang peserta didik masuk setiap hari secara bergantian
2022-01-04 09:06:21+00:00,antaranews,nah jadi memang kita tidak publikasi karena sifatnya projustitia dan hanya bisa digunakan saat proses di penga
2022-01-04 09:06:20+00:00,publicanews,Cerai Aldi Bragi Nafkahi Ririn Rp 30 Juta Selama Masa Iddah
2022-01-04 09:06:15+00:00,iskandarhelmi47,Kementan Kembangkan Program Integrated Farming Berbasis Jagung
2022-01-04 09:06:14+00:00,AmirGrage,RT Polda Jabar harus profesional dan adil dalam memproses kasus pidana yang ditangani
2022-01-04 09:06:05+00:00,__azrie,RT BERITA TERKINI Ada perempuan feminist panggil Allah SWT dengan ganti nama She bukan He Ini dah cukup melampau kera
2022-01-04 09:06:04+00:00,publicanews,Berkas Perkara Suap Bupati Kolaka Timur Telah Lengkap
2022-01-04 09:05:55+00:00,Hafizah_AH,RT Rakyat kena berani untuk melangkah ke depan memilih pemimpin pemimpin yang pandai berkebolehan dan berkelayakan itu yang p
2022-01-04 09:05:55+00:00,fzpermana,IAI tugasnya oppressing arsitek muda untuk melayani yang tua Urusan
2022-01-04 09:05:52+00:00,republikaonline,Beberapa proyek strategis di 2022 telah memasuki masa akhir untuk segera diresmikan
2022-01-04 09:05:51+00:00,publicanews,KPK Sita Dokumen dari Rumah eks Dirjen Bina Keuangan Daerah Kemendagri
2022-01-04 09:05:51+00:00,KangFathanNow,GusMuhaimin mendorong pemerintah mengoptimalkan Energi Baru Terbarukan EBT amp tidak sepenuhnya bergantung pada en
2022-01-04 09:05:51+00:00,muhariyun,RT nah sebenarnya berita ini menjelaskan kelakuan POLRI
2022-01-04 09:05:51+00:00,beautynesia_id,Digaruk Tinggalkan Bekas Tak Digaruk Sangat Gatal Ini 3 Perawatan Eksim pada Wajah Biar Nggak Serba Salah
2022-01-04 09:05:48+00:00,mcxxiw,aku gadibolehin nabila buka twt drtd aowkwkkw gegara berita dan rumor itu pdhl gue kebal bgt dah seterong
2022-01-04 09:05:47+00:00,saltysea___,Mjb kak boleh tau kakak kerja di media berita apa Dan sedang ada lowongan untuk anak magang gak kak
2022-01-04 09:05:42+00:00,gadistrihs,RT Sbg peneliti di konservasi alam sya sgt sedih dengan berita ini Mungkin belum banyak yg tahu kalau Eijkman juga menjadi l
2022-01-04 09:05:40+00:00,publicanews,Uang dan Aset Rp 80 M Disita KPK dari Dua Korporasi
2022-01-04 09:05:38+00:00,ugra__,RT Anda tu jogja kok malah sibuk permasalahkan penggunaan kata klitih yg dianggap egk ada bahasa hukumnya Apa lupa y
2022-01-04 09:05:33+00:00,Syamsud76579252,RT Riyadh dituduh membantu menyebarkan ideologi Islam ekstremis di seluruh dunia
2022-01-04 09:05:32+00:00,Swararka1,Kalo ketangkep langsung dor aja kakinya byar cacat Medan Semakin Tidak Aman Petugas Kebersihan
2022-01-04 09:05:28+00:00,berita_tular,Tasik Cermin dibuka semula kepada pengunjung 15 Januari ini
2022-01-04 09:05:28+00:00,Imade_kun,RT Kasus Denny Siregar di Polda Jabar sudah berjalan lebih dari satu tahun
2022-01-04 09:05:26+00:00,itmeonlyhere,RT alsiddiqiy Berita baik Ada dermawan sponsor dua buah kitab Syarah Aqidah Imam Al Nawawi Justeru saya nak buat giveaway dua na
2022-01-04 09:05:25+00:00,RuslanGasang,RT Kinerja kepolisian dalam menangani kasus dugaan ujaran kebencian disorot publik
2022-01-04 09:05:25+00:00,publicanews,2 Eks Pegawai Wika Dicecar Penerimaan Uang dan Dokumen Pembangunan IPDN Sulut
2022-01-04 09:05:16+00:00,Bhrigutantra,RT Ahli Pastikan 6 Laskar FPI Korban Unlawful Killing Tewas Tertembak
2022-01-04 09:05:04+00:00,Foo35945383,RT PASCA BANJIR Perdana Menteri Datuk Seri Ismail Sabri Yaakob memaklumkan RM33 juta daripada RM93 juta permohonan Pinjaman
2022-01-04 09:05:04+00:00,kabarselebes,Satu DPO MIT Poso Tewas Ditembak
2022-01-04 09:05:02+00:00,kabarselebes,Aksi Unjukrasa Persatuan Tenaga Kerja Blockade Jalur PT Transon Bumindo Resources
2022-01-04 09:05:00+00:00,xcorke,RT Sehari Setelah Divaksin Siswa MI di Magetan Meninggal Dunia
2022-01-04 09:04:55+00:00,frznmd,RT Banjir Bimbang air naik lagi penduduk Bukit Changgang tutup ban pecah dengan batang kelapa sawit
2022-01-04 09:04:52+00:00,LPMIndustria,Kira kira bagaimana teknis perawatan hidroponik yang benar Yu kita cari tahu selengkapnya di
2022-01-04 09:04:50+00:00,UntungW12319175,RT Ceramah menuduh Polri membunuh 6 FPI pengawal Rizieq Difitnah dgn keji dgn kata Dibunuh disiksa dikuliti dicabut k
2022-01-04 09:04:45+00:00,ndzrh__,RT BERITA TERKINI Ada perempuan feminist panggil Allah SWT dengan ganti nama She bukan He Ini dah cukup melampau kera
2022-01-04 09:04:38+00:00,grapemintluv,gada berita apa gt
2022-01-04 09:04:37+00:00,bijikopi80,RT Mohon Bantuan kepada rekan rekan Berita Orang Hilang atas nama Nama Sukri Umur 71 thn Alamat Sipelem Rt 21 Rw 6 D
2022-01-04 09:04:36+00:00,hadizalhe,RT Selang beberapa hari selepas Leong Mun Yee umum persaraan dari sukan terjun kini giliran Cheong Jun Hoong pula ucap selam
2022-01-04 09:04:35+00:00,AmirGrage,RT Bahar Smith Ditetapkan Jadi Tersangka Kuasa Hukum Kami Menduga Ada Sponsor Dibelakang Semua Ini
2022-01-04 09:04:35+00:00,Milah68614490,RT Kasus Denny Siregar di Polda Jabar sudah berjalan lebih dari satu tahun
2022-01-04 09:04:33+00:00,kodim0416bungo1,Tim Vaksin Mobile Kodim 0416 Bute sambangi SD 065 VIII Pulau Panjang
2022-01-04 09:04:33+00:00,abzadaz,Bunuh warga Suryah dengan SADIS Emang lu pikir yg dibunuh syiah doang Emang lu pikir ISIS angg
2022-01-04 09:04:30+00:00,SIrap_limao,RT Pendiriannya itu mencetus tentangan daripada para pegawai Israel dan juga pujian daripada pengguna media sosial yang pro Pale
2022-01-04 09:04:29+00:00,anggek,RT Cuma U23 lho pak itupun hanya AFF bukan AFC atau Piala Dunia Toh mereka berdua dah berstatus pemain Timnas Senior Kasih
2022-01-04 09:04:23+00:00,beritajatimcom,Usai Assessment 45 Orang Pendaftar JPTP Bakal Wawancara dengan Pansel Berita Terkini News beritajatim Jatim
2022-01-04 09:04:22+00:00,beritajatimcom,Buruh Hair Star Indonesia Demo Tuntut Pesangon Berita Terkini News beritajatim Jatim
2022-01-04 09:04:21+00:00,alan_dofa,RT Kinerja kepolisian dalam menangani kasus dugaan ujaran kebencian disorot publik
2022-01-04 09:04:20+00:00,beritajatimcom,Wartawan Bojonegoro Unjuk Rasa Tuntut Kemerdekaan Pers Berita Terkini News beritajatim Jatim
2022-01-04 09:04:19+00:00,KATADATAcoid,Kementerian BUMN dan Kementerian ESDM bersama kementerian terkait lainnya tengah berbagi tugas untuk mencari jalan
2022-01-04 09:04:19+00:00,beritajatimcom,Eri Cahyadi Tantang Lurah di Surabaya untuk Mundur Berita Terkini News beritajatim Jatim
2022-01-04 09:04:19+00:00,Nurizal,RT Helikopter Israel tersebut jatuh ketika sedang menjalani latihan penerbangan
2022-01-04 09:04:17+00:00,beritajatimcom,Persebaya Tanpa 4 Pemain Timnas Aji Santoso Tagih Janji PSSI Berita Terkini News beritajatim Jatim
2022-01-04 09:04:15+00:00,BUMN_Biak_Ayo,Sobat BUMN BUMN FLASH NEWS di Episode ke 32 kembali menghadirkan informasi 7 berita amp produk BUMN terbaik diant
2022-01-04 09:04:15+00:00,JackBoea2,RT Kinerja kepolisian dalam menangani kasus dugaan ujaran kebencian disorot publik
2022-01-04 09:04:15+00:00,beritajatimcom,Vaksinasi Anak anak di Ponorogo Bakal Dimulai Minggu Ini Berita Terkini News beritajatim Jatim
2022-01-04 09:04:14+00:00,republikaonline,Riyadh dituduh membantu menyebarkan ideologi Islam ekstremis di seluruh dunia
2022-01-04 09:04:13+00:00,beritajatimcom,Ternyata Ada Kebun Ganja di Probolinggo Berita Terkini News beritajatim Jatim
2022-01-04 09:04:13+00:00,Nurizal,RT Kabid Humas Polda Jawa Barat Kombes Pol Ibrahim Tompo memastikan Bahar Smith BS telah ditahan di Rumah Tahanan Rutan Po
2022-01-04 09:04:12+00:00,beritajatimcom,Gubernur Khofifah Tinjau PTM Terbatas di Gresik Berita Terkini News beritajatim Jatim
2022-01-04 09:04:11+00:00,Luken97469027,Malulah punya kader bodoh seperti ini
2022-01-04 09:04:03+00:00,VIVAcoid,Ahli Pastikan 6 Laskar FPI Korban Unlawful Killing Tewas Tertembak
2022-01-04 09:03:59+00:00,RafikaBayu,RT Erick Thohir berharap para santri siap mengembangkan diri secara mandiri dengan membentuk perekonomian kreatif atau UMKM dalam
2022-01-04 09:03:57+00:00,manusialelabah,RT Pendiriannya itu mencetus tentangan daripada para pegawai Israel dan juga pujian daripada pengguna media sosial yang pro Pale
2022-01-04 09:03:52+00:00,Bacan66311513,RT Polda Jabar Resmi Tetapkan Habib Bahar bin Smith Jadi Tersangka Ujaran Kebencian
2022-01-04 09:03:51+00:00,DidingNurislam,RT Kasus Denny Siregar di Polda Jabar sudah berjalan lebih dari satu tahun
2022-01-04 09:03:48+00:00,rigmaloringan,RT Kebijakan yang diambil pemerintah melarang ekspor batubara untuk menjaga keandalan listrik nasional dan melindungi kepent
2022-01-04 09:03:36+00:00,RafikaBayu,RT santik4 Masih belum bisa mup on dari berita Jaksa Agung yg memberi apresiasi tinggi kepada Menteri BUMN Erick Thohir atas kon
2022-01-04 09:03:35+00:00,arissadays,RT HAIII SEMUAA ADA BERITA GEMBIRA BATH amp BODY WORKS BUAT SALE 75 OFF jomm joinnn PS ira cas RM2 sahaja body mist
2022-01-04 09:03:35+00:00,SoniMsi07,RT Mereka akan bilang ini Kriminalisasi ulama Tapi kata HabibZen Anda itu nyembah Nasab anda dudukkan Nasab itu diatas
2022-01-04 09:03:34+00:00,PelatihBart,Boscang Ini merupakan berita terakhir sebelum tv dimatiin
2022-01-04 09:03:34+00:00,SinarOnline,Selang beberapa hari selepas Leong Mun Yee umum persaraan dari sukan terjun kini giliran Cheong Jun Hoong pula uca
2022-01-04 09:03:34+00:00,inewsdotid,Buru Warga Palestina yang Kabur dari Rudenim Polisi Kami Yakin Masih di Wilayah Jatim wargapalestina kabur
2022-01-04 09:03:31+00:00,rrudi9,Abis liat berita laki2 loncat dr mall krn putus cinta gokil gw pikir orang model begitu udah punah taunye masi
2022-01-04 09:03:28+00:00,Lucasandiaga,ri Kuy guys baca dulu berita terupdate dari bp2mi hari ini
2022-01-04 09:03:25+00:00,rashdanmarzuki,RT Pendiriannya itu mencetus tentangan daripada para pegawai Israel dan juga pujian daripada pengguna media sosial yang pro Pale
2022-01-04 09:03:24+00:00,berita_gempa,RT GLC Orang utan cuba melawan jentera yang sedang hancurkan rumahnya Sedihnya
2022-01-04 09:03:17+00:00,jawapos,Bupati Sugiri Bakal Pindah PKL Jalan HOS Tjokroaminoto ke Pasar Legi Selatan
2022-01-04 09:03:16+00:00,putry_najjah,RT BERITA TERKINI Ada perempuan feminist panggil Allah SWT dengan ganti nama She bukan He Ini dah cukup melampau kera
2022-01-04 09:03:13+00:00,RaymondsMunthe,Bahlil utk DKI 1 Bursa Pilgub DKI Jakarta 2024 menggeliat seiring masa jabatan Gubernu
2022-01-04 09:03:12+00:00,bimantaraadji,RT Sbg peneliti di konservasi alam sya sgt sedih dengan berita ini Mungkin belum banyak yg tahu kalau Eijkman juga menjadi l
2022-01-04 09:03:11+00:00,Syamsud76579252,RT Pasien kedua belum bisa dipastikan terpapar Covid 19 varian Omicron
2022-01-04 09:03:11+00:00,Lucasandiaga,RT ri Semangat hari Senin ya SobatMigran Pagi ini jangan lupa untuk baca berita ter update rangkuman BP2MI selama sepekan BP2
2022-01-04 09:03:11+00:00,daarutauhiidBDG,Berita DT hari ini Berikut informasi baru seputar Program Daarut Tauhiid untuk mengetahui informasi terbaru dari
2022-01-04 09:03:08+00:00,hartono_mulyadi,RT 79 Lupakan sejenak hendro priyono pak cepat angkat ke permukaan apa yg jadi beban mu hingga sulit sekali meng
2022-01-04 09:03:07+00:00,onassis_siregar,RT Innalillahi wa innalillahi Rajiun Tidak kaget sebenarnya mendengar berita ini karena sudah diprediksi akan seperti ini
2022-01-04 09:03:05+00:00,Kankali1,RT ferry Menyelesaikan masalah dengan meninggalkan masalah baru Tanggung jawab siapa Pemprov DKI atau Kontraktor Sumur Resapan
2022-01-04 09:03:04+00:00,Arf_f4d,RT Indonesia Gunung Semeru kembali menggeliat pada hari Senin 3 1 pukul 12 25 WIB PVMBG mencatat kolom abu teramati kurang lebih
2022-01-04 09:02:57+00:00,republikaonline,Pasien kedua belum bisa dipastikan terpapar Covid 19 varian Omicron
2022-01-04 09:02:53+00:00,NTMY44197549,RT Polda Jabar harus profesional dan adil dalam memproses kasus pidana yang ditangani
2022-01-04 09:02:52+00:00,NaysaPutri14,Baik nya sy usul pd Lawyer Bahar hub Si Novel Ompong order Demo Berjilid Jilid jika Perlu 130 Jt Pendukung Novel
2022-01-04 09:02:46+00:00,beritamanado,Berita terbaru Lynda Watania Jabat Kadis Dukcapil Olly Dondokambey Sampaikan Tugas Ini
2022-01-04 09:02:44+00:00,MaduRizqina,RT Kinerja kepolisian dalam menangani kasus dugaan ujaran kebencian disorot publik
2022-01-04 09:02:36+00:00,DidingNurislam,RT Kasus Denny Siregar di Polda Jabar sudah berjalan lebih dari satu tahun
2022-01-04 09:02:23+00:00,insanekimhv,RT Tiada lagi walk in untuk dapatkan suntikan dos penggalak Protecthealth AWANInews AWANI745 Ha
2022-01-04 09:02:21+00:00,ANTARABengkulu,Tips menghilangkan lemak perut menurut para ahli ANTARA News Bengkulu
2022-01-04 09:02:19+00:00,daarutauhiidBDG,Berita DT hari ini Berikut informasi baru seputar Program Daarut Tauhiid untuk mengetahui informasi terbaru dari
2022-01-04 09:02:18+00:00,FirmanSupriadi7,RT IPW menilai Polda Jabar perlu mencopot penyidik kasus kasus yang mangkrak
2022-01-04 09:02:17+00:00,menda_endy,RT Om lizal lamli jgn pingsan ya baca berita ini
2022-01-04 09:02:15+00:00,Priekusmo,RT Anda tu jogja kok malah sibuk permasalahkan penggunaan kata klitih yg dianggap egk ada bahasa hukumnya Apa lupa y
2022-01-04 09:02:14+00:00,AriefAnarya,RT Ceramah menuduh Polri membunuh 6 FPI pengawal Rizieq Difitnah dgn keji dgn kata Dibunuh disiksa dikuliti dicabut k
2022-01-04 09:02:12+00:00,detikcom,Warga di Depok protes gara gara ada warga yang membangun tembok di jalan hingga menghalangi saluran air Warga khaw
2022-01-04 09:02:10+00:00,nanadewdrops,RT Pendiriannya itu mencetus tentangan daripada para pegawai Israel dan juga pujian daripada pengguna media sosial yang pro Pale
2022-01-04 09:02:06+00:00,publicanews,Berkas Perkara 3 Tersangka Kasus Proyek Jalan Bengkalis Dinyatakan Lengkap
2022-01-04 09:02:05+00:00,RuslanGasang,RT ipeh HBS langsung ditahan untuk 20 hari kedepan HBD di jerat Pasal 14 ayat 1 UU RI Nomor 1 Tahun 1946 Pasal itu berbunyi
2022-01-04 09:02:03+00:00,Pura2demoCRAZY,RT 79 Lupakan sejenak hendro priyono pak cepat angkat ke permukaan apa yg jadi beban mu hingga sulit sekali meng
2022-01-04 09:02:02+00:00,ainaafrhah,RT Mereka diuji sekali lagi dengan gelombang kedua banjir pada hari pertama tahun baharu AWANInews AWANI745 Banjir2021 https
2022-01-04 09:01:56+00:00,Milah68614490,RT IPW menilai Polda Jabar perlu mencopot penyidik kasus kasus yang mangkrak
2022-01-04 09:01:56+00:00,ZafiaUfairah,RT ipeh HBS langsung ditahan untuk 20 hari kedepan HBD di jerat Pasal 14 ayat 1 UU RI Nomor 1 Tahun 1946 Pasal itu berbunyi
2022-01-04 09:01:55+00:00,publicanews,Mahfud MD Tidak Ambil Pusing Klaim Tommy Soeharto Tak Punya Utang BLBI
2022-01-04 09:01:54+00:00,kotapontianak_,Covid 19 Melandai Wali Kota Edi Kamtono Minta Warga Jangan Lengah Pemerintah Kota Pontianak
2022-01-04 09:01:47+00:00,CepiCepot83,RT zaki ketika pembahasan ceramah tentang KM 50 DIANGGAP berita bohong langsung masuk jadi TERSANGKA PADAHAL sudah JELAS ko
2022-01-04 09:01:43+00:00,publicanews,Supervisor Tim Pejabat Pajak Wawan Ridwan Segera Disidang
2022-01-04 09:01:43+00:00,dyzmri,RT BERITA TERKINI Ada perempuan feminist panggil Allah SWT dengan ganti nama She bukan He Ini dah cukup melampau kera
2022-01-04 09:01:42+00:00,jawapos,Daerah Pegunungan Masih Berpeluang Muncul Gerakkan Unstabilitas
