waktu,username,text2022-01-04 08:53:49+00:00,mulaiberhitungg,Kalo dari berita diatas sih hak siar bakal diambil mnc
2022-01-04 08:53:49+00:00,05Ramli,RT PPP Ke depan bagaimana memberikan kepastian kepada para periset tersebut Nah para peneliti harus tetap diakomodir jangan sampa
2022-01-04 08:53:38+00:00,fleurmacchiato,RT Tiada lagi walk in untuk dapatkan suntikan dos penggalak Protecthealth AWANInews AWANI745 Ha
2022-01-04 08:53:37+00:00,CFC_khairulcisc,Sebagian kutipan Berita tidak langsung saya kutip dari sumbernya langsung saya mengambilnya dari
2022-01-04 08:53:35+00:00,veraagustian_,RT RI Rudi Hartono Bangun Bantu Pembangunan Masjid di Langkat
2022-01-04 08:53:32+00:00,_rezarazali_,Dalam surah AlBaqarah ayat 155 Dan sesungguhnya Kami akan menguji kamu dengan sedikit perasaan takut kepada musu
2022-01-04 08:53:32+00:00,ko_chenk1,RT Ceramah menuduh Polri membunuh 6 FPI pengawal Rizieq Difitnah dgn keji dgn kata Dibunuh disiksa dikuliti dicabut k
2022-01-04 08:53:29+00:00,Media_Selangor,RT Terima kasih kepada kakitangan kerajaan Selangor yg bertungkus lumus membantu membersihkan kawasan pasca banjir Jasa amp bak
2022-01-04 08:53:25+00:00,haziqbrhm,RT media Ribuan gelinciran tanah dan aliran puing menjadi punca utama fenomena Banjir Puing di kawasan lembah tanah tinggi di Lemb
2022-01-04 08:53:25+00:00,sabanabana5,RT zaki ketika pembahasan ceramah tentang KM 50 DIANGGAP berita bohong langsung masuk jadi TERSANGKA PADAHAL sudah JELAS ko
2022-01-04 08:53:24+00:00,fvkaji,Nyebarin berita hoax min ofc
2022-01-04 08:53:20+00:00,widodogroho,Keluarga Ikhlaskan Meninggalnya Siswa MI Magetan Sehari Usai Vaksinasi
2022-01-04 08:53:17+00:00,soegengjwahaiy,RT Perasaanya slsi terjawab
2022-01-04 08:53:14+00:00,DPR_RI,Johan Rosihan Selama Tahun 2021 Harga Produk Pangan Terus Melonjak
2022-01-04 08:53:11+00:00,black_roses00,RT alam Kami mendapat berita satu lagi projek menjahanamkan alam projek korek pasir yg ada kaitan dgn kerabat raja Perak akan d
2022-01-04 08:53:11+00:00,imamjohari8,RT Habib Bahar sebut para pesita agama juga dilaporkan tapi tidak diproses polisi
2022-01-04 08:53:07+00:00,NgaKorMing,Terima kasih kepada kakitangan kerajaan Selangor yg bertungkus lumus membantu membersihkan kawasan pasca banjir Ja
2022-01-04 08:53:06+00:00,EngearTv,King kekal jadi permintaan tinggi guys engeartv myvi perodua king
2022-01-04 08:53:06+00:00,projekmm,King kekal jadi permintaan tinggi guys engeartv myvi perodua king
2022-01-04 08:53:05+00:00,anggaramarthaP,Berita bahagia pagi ini Terimakasih terimakasih buat semua yang support Istrikuuuuuu terimakasih kel
2022-01-04 08:53:04+00:00,askmearmything,gw malah galfok sama berita yang kanan patokan kita kan india ya yang deltanya juga gila2an kalo omicron juga g
2022-01-04 08:53:03+00:00,SinarOnline,Ahmad Faizal menyifatkan Cheng Hoe sebagai tokoh bola sepak tersohor serta berpengalaman luas susulan pelbagai keja
2022-01-04 08:53:02+00:00,republikaonline,Kasus Denny Siregar di Polda Jabar sudah berjalan lebih dari satu tahun
2022-01-04 08:52:56+00:00,s0mersault___,RT Sehari Setelah Divaksin Siswa MI di Magetan Meninggal Dunia
2022-01-04 08:52:55+00:00,meeeeeeeeell_,Tapi kaya ga diberitakan Hahah dikira kalo gada berita itu berarti corona udah ilang kali yak
2022-01-04 08:52:52+00:00,videl58530077,RT Kinerja kepolisian dalam menangani kasus dugaan ujaran kebencian disorot publik
2022-01-04 08:52:52+00:00,mowglindo,statistics Ayo kt measurement tanpa bias soal happiness dlm berita ini
2022-01-04 08:52:51+00:00,DPR_RI,Imbau Kebijakan PTM 100 Persen Dievaluasi Puan Lengkapi Vaksinasi Terlebih Dahulu
2022-01-04 08:52:50+00:00,GanjarNEWS,7 Daerah di Jateng Naik Jadi PPKM Level 2 Ganjar Belum Mencemaskan detikNews GanjarPranowo Ganjar
2022-01-04 08:52:44+00:00,joe_sithosi,RT Polda Jabar harus profesional dan adil dalam memproses kasus pidana yang ditangani
2022-01-04 08:52:42+00:00,clouudtsrr,BERITA HOT
2022-01-04 08:52:36+00:00,AjoAriSikumbang,RT ipeh HBS langsung ditahan untuk 20 hari kedepan HBD di jerat Pasal 14 ayat 1 UU RI Nomor 1 Tahun 1946 Pasal itu berbunyi
2022-01-04 08:52:35+00:00,semestasaid,berita apa ris
2022-01-04 08:52:32+00:00,yana_diah,RT Bukti rumah DP 0 rupiah tidak bisa dinikmati warga miskin Anies Ngibul Neno ngibul Panji ngibul
2022-01-04 08:52:29+00:00,beritamanado,Berita terbaru Ritual Adat Tahunan Watu Pinabetengan Souissa Serius Ingatkan Hal Ini
2022-01-04 08:52:27+00:00,republikaonline,Penegak hukum harus berani mengungkap motif pelaku yang membuang korban ke sungai
2022-01-04 08:52:27+00:00,DPR_RI,Said Abdullah Larangan Ekspor Batu Bara Berdampak Turunnya Devisa Negara
2022-01-04 08:52:14+00:00,fpoemsh,RT Polda Jabar harus profesional dan adil dalam memproses kasus pidana yang ditangani
2022-01-04 08:52:13+00:00,ryolandafit,RT Saat ini harga telur ayam sudah berangsur turun dari Rp 32 000 kg dan saya targetkan menjadi Rp 27 000 kg di wilayah Jakarta
2022-01-04 08:52:12+00:00,muispebrianto,RT Barbar Smith minta umat Islam dan ulama terus berjuang walaupun dia ditahan
2022-01-04 08:52:09+00:00,shachan9370,Wishlist langsung bubar ambyar liat berita kalo sepanjang tahun 2022 wajib karantina hotel 10 14 hari langsung de
2022-01-04 08:52:06+00:00,DPR_RI,Penerapan PTM 100 Persen Netty Prasetiyani Penerapan Prokes Harus Diawasi
2022-01-04 08:52:01+00:00,nadomeolla_,RT BERITA TERKINI Ada perempuan feminist panggil Allah SWT dengan ganti nama She bukan He Ini dah cukup melampau kera
2022-01-04 08:51:51+00:00,xarunika,No kl pun lanjut bakalan makin dihujat Kasusnya dia terhitung skandal bkn sekedar berita putus scr baik2 Org2 g
2022-01-04 08:51:46+00:00,fatputra,RT Belum lama ini wacana terkait gaji baru PNS minimal Rp 9 juta per bulan kembali diperbincangkan Bagaimana sebenarnya ht
2022-01-04 08:51:41+00:00,DPR_RI,Legislator Berharap Pelarangan Ekspor Batu Bara Bukan Sekadar Gertak Sambal
2022-01-04 08:51:41+00:00,republikaonline,Di SKB empat menteri tidak ada pilihan kecuali PTM Disdik DKI tetap beri pilihan
2022-01-04 08:51:39+00:00,hwift_,RT Pendiriannya itu mencetus tentangan daripada para pegawai Israel dan juga pujian daripada pengguna media sosial yang pro Pale
2022-01-04 08:51:34+00:00,hbaBayu1,RT Anda tu jogja kok malah sibuk permasalahkan penggunaan kata klitih yg dianggap egk ada bahasa hukumnya Apa lupa y
2022-01-04 08:51:26+00:00,antaranews,Mereka melihat bagaimana kita bisa membangun keutuhan bangsa karena ada kesepakatan Pancasila Jadi mereka kagum
2022-01-04 08:51:25+00:00,denni_sauya,RT abdhi Menteri BUMN Erick Thohir menghadiri istighosah di Pondok Pesantren Amanatul Ummah Kabupaten Mojokerto Jawa Timur pada
2022-01-04 08:51:21+00:00,voidotid,DKI Jakarta kembali masuk sebagai wilayah PPKM Level 2 Keputusan ini tertuang dalam Instruksi Mendagri Inmendagri
2022-01-04 08:51:17+00:00,DPR_RI,Cegah Penambahan Kasus Omicron Pemerintah Diminta Lakukan Antisipasi
2022-01-04 08:51:17+00:00,keranisaka,RT Anda tu jogja kok malah sibuk permasalahkan penggunaan kata klitih yg dianggap egk ada bahasa hukumnya Apa lupa y
2022-01-04 08:51:15+00:00,Yunus05675952,RT Kinerja kepolisian dalam menangani kasus dugaan ujaran kebencian disorot publik
2022-01-04 08:51:15+00:00,umam_chaerul,RT Innalillahi Demokrasi benar 2 sdh mati Habib Bahar Bin Smith Ditetapkan Sebagai Tersangka Dengan UU ITE Penyebaran
2022-01-04 08:51:13+00:00,ArtOfpol,RT Erick Thohir berharap para santri siap mengembangkan diri secara mandiri dengan membentuk perekonomian kreatif atau UMKM dalam
2022-01-04 08:51:11+00:00,jawapos,DBD Renggut 2 Nyawa Warga Pacitan Cikungunya Jangkit 123 Warga
2022-01-04 08:51:10+00:00,z_pilli,RT RI Ahmad Sahroni Polri Harus Bebas dari Kepentingan Politik
2022-01-04 08:51:10+00:00,AfiqShari,RT Masuk dah berita kebabian 2022
2022-01-04 08:51:07+00:00,veraagustian_,RT Jakarta dinyatakan sebagai wilayah PPKM level 2 Apakah ini gara gara Omicron
2022-01-04 08:51:06+00:00,TerjemahanAmino,Berita Harian Polis AS guna bom peledak silau semburan lada gas pemedih mata Julai 26 2020 Petikan Poli
2022-01-04 08:51:05+00:00,Najwaaaaaaaaa_,RT Pengguna lebuh raya yang ingin ke pekan Karak tidak perlu membuat pusingan u sebelum Plaza Tol Karak dan boleh meneruskan p
2022-01-04 08:50:58+00:00,DPR_RI,Rudi Hartono Bangun Bantu Pembangunan Masjid di Langkat
2022-01-04 08:50:54+00:00,wanfarlee,Masuk dah berita kebabian 2022
2022-01-04 08:50:53+00:00,kumhamsumsel,RT Tingkatkan Kemampuan Baca Al qur an WBP Lapas Empat Lawang Rutin Menggelar Pembinan Kerohanian Selengkapnya
2022-01-04 08:50:50+00:00,tega_ya,Ratusan Wanita Muslim Ditampilkan di Sebuah Aplikasi untuk Dilelang Viva
2022-01-04 08:50:49+00:00,beautynesia_id,Para Artis Korea Ini Sering Dikira Blasteran Karena Punya Wajah yang Mirip Bule
2022-01-04 08:50:44+00:00,kuasakatacom,PTM 100 Persen di Jateng Digelar Ganjar Perintahkan Daerah Awasi Pelaksanaannya
2022-01-04 08:50:38+00:00,DPR_RI,PTM 100 Persen Dimulai Sufmi Dasco Waspadai Klaster Sekolah
2022-01-04 08:50:38+00:00,detikcom,Saat ini harga telur ayam sudah berangsur turun dari Rp 32 000 kg dan saya targetkan menjadi Rp 27 000 kg di wilay
2022-01-04 08:50:38+00:00,AmrlArf1,RT BERITA TERKINI Ada perempuan feminist panggil Allah SWT dengan ganti nama She bukan He Ini dah cukup melampau kera
2022-01-04 08:50:36+00:00,Prah76142776,RT Ceramah menuduh Polri membunuh 6 FPI pengawal Rizieq Difitnah dgn keji dgn kata Dibunuh disiksa dikuliti dicabut k
2022-01-04 08:50:33+00:00,antaramalaysia,Sarbumusi operasionalkan mobil jenazah untuk pekerja migran
2022-01-04 08:50:33+00:00,amrmrsyd_,RT Saman difailkan pengundi itu membabitkan Langkah Sheraton AWANInews AWANI745
2022-01-04 08:50:25+00:00,publicanews,Suga BTS Pecahkan Rekor 10 Juta Pendengar Spotify Makin Tajir Aja
2022-01-04 08:50:18+00:00,kanwilkemenagsu,Kakanwil Kemenagsu dan Mantan Kakanwil Kemenagsu Riung di Tasyakuran HAB 76
2022-01-04 08:50:14+00:00,justfendi1,cyber mba coba cari berita kenapa ormas sep
2022-01-04 08:50:14+00:00,hmzhfaris,RT Ratusan kenderaan dilihat berhenti di jalan raya ketika orang ramai mahu menikmati cuaca luar biasa di kawasan berdekatan sem
2022-01-04 08:50:12+00:00,publicanews,Olla Ramlan Tiba tiba Bicara Misalkan Aku Berpisah
2022-01-04 08:50:08+00:00,DPR_RI,Said Abdullah Pemerintah Perlu Pastikan Ketersediaan Cadangan Batu Bara Nasional
2022-01-04 08:50:07+00:00,yayonim,Tengah kira tolak tambah lagi patut ke tak beli sg pentagon Ni kalau dapat berita boleh sambung kontrak i beli K
2022-01-04 08:50:06+00:00,lapas4lawang,Tingkatkan Kemampuan Baca Al qur an WBP Lapas Empat Lawang Rutin Menggelar Pembinan Kerohanian Selengkapnya
2022-01-04 08:50:04+00:00,yadhiyadhiyadhi,RT Polda Jabar harus profesional dan adil dalam memproses kasus pidana yang ditangani
2022-01-04 08:50:04+00:00,idoelqueenie,Apkah biasa nya berita hoax berakhir dg materai ya
2022-01-04 08:50:04+00:00,adlyzulkefly,RT Tiada lagi walk in untuk dapatkan suntikan dos penggalak Protecthealth AWANInews AWANI745 Ha
2022-01-04 08:50:03+00:00,aijieraijie,RT Pengeluaran KWSP setiap kali bencana bukan tindakan bijak NUBE AWANInews AWANIpagi
2022-01-04 08:50:00+00:00,publicanews,Lee Da In Bicara Tawa dan Asmaranya dengan Lee Seung Gi
2022-01-04 08:50:00+00:00,ryolandafit,RT Dinas Kesehatan DKI Jakarta menuturkan dari 162 yang kasus 6 orang di antaranya merupakan transmisi lokal
2022-01-04 08:49:58+00:00,TPawantoo_,Polri gak angkat berita ini
2022-01-04 08:49:58+00:00,infoSumbar,Sasar 224 Kabupaten Kota 12 Januari Pemerintah Mulai Pelaksanaan Vaksinasi Booster via infosumbar
2022-01-04 08:49:57+00:00,FaridAlwaini,RT Kinerja kepolisian dalam menangani kasus dugaan ujaran kebencian disorot publik
2022-01-04 08:49:52+00:00,shilaaryn,RT Cuma U23 lho pak itupun hanya AFF bukan AFC atau Piala Dunia Toh mereka berdua dah berstatus pemain Timnas Senior Kasih
2022-01-04 08:49:49+00:00,anjasmara_ferry,Pengacara HBS mengatakan penetapan tersangka pada HBS terlalu cepat dan meminta penangguhan penahanan terhadap HBS
2022-01-04 08:49:48+00:00,publicanews,Harga Piyama BTS Rp 1 4 Juta Bikin Army Sewot
2022-01-04 08:49:47+00:00,DPR_RI,Eijkman Melebur ke BRIN DPR Minta Hak Pegawai dan Peneliti Tetap Diperhatikan
2022-01-04 08:49:45+00:00,0321Rohil,Lanjutkan Vaksin bersama Babinsa Koramil 0321 01 Bangko di Perumahan Jalan Bintang Hulu
2022-01-04 08:49:42+00:00,Hanarovski,RT Pendiriannya itu mencetus tentangan daripada para pegawai Israel dan juga pujian daripada pengguna media sosial yang pro Pale
2022-01-04 08:49:41+00:00,onassis_siregar,RT Sehari Setelah Divaksin Siswa MI di Magetan Meninggal Dunia
2022-01-04 08:49:41+00:00,alfaxmn,RT Pendiriannya itu mencetus tentangan daripada para pegawai Israel dan juga pujian daripada pengguna media sosial yang pro Pale
2022-01-04 08:49:41+00:00,kamarulbahrin,RT Saman difailkan pengundi itu membabitkan Langkah Sheraton AWANInews AWANI745
2022-01-04 08:49:39+00:00,mohdalifimran_,RT Pendiriannya itu mencetus tentangan daripada para pegawai Israel dan juga pujian daripada pengguna media sosial yang pro Pale
2022-01-04 08:49:39+00:00,ryolandafit,RT PTM 100 Persen Siswa dan Guru Wajib Check In PeduliLindungi
2022-01-04 08:49:38+00:00,detikcom,Dinas Kesehatan DKI Jakarta menuturkan dari 162 yang kasus 6 orang di antaranya merupakan transmisi lokal
2022-01-04 08:49:36+00:00,bharianmy,BHnasional Penduduk Taman Sri Muda resah bantuan banjir belum diterima mohon kerajaan segerakan
2022-01-04 08:49:33+00:00,publicanews,Ivan Gunawan Bantah Adopsi Bayi Iblis
2022-01-04 08:49:29+00:00,MalikRidhwan,RT Tiada lagi walk in untuk dapatkan suntikan dos penggalak Protecthealth AWANInews AWANI745 Ha
2022-01-04 08:49:28+00:00,AditMokodompit,RT RI Ahmad Sahroni Polri Harus Bebas dari Kepentingan Politik
2022-01-04 08:49:22+00:00,0321Rohil,Monitoring Vaksin Wadanramil Kunjungi SMAN 1 Bangko
2022-01-04 08:49:20+00:00,publicanews,Saya Berkulit Hitam dan Saya Yahudi Apa Salahnya
2022-01-04 08:49:17+00:00,c_muhan,bener pack fpi itu suka berdakwah bukan suka segel tempat ibada
2022-01-04 08:49:10+00:00,501Awani,Saman difailkan pengundi itu membabitkan Langkah Sheraton AWANInews AWANI745
2022-01-04 08:49:10+00:00,DPR_RI,Ahmad Sahroni Polri Harus Bebas dari Kepentingan Politik
2022-01-04 08:49:08+00:00,iceyteru,Moga papan berita inazuma update lg soal heizhou crumbs
2022-01-04 08:49:07+00:00,publicanews,Aktor Terkenal Myanmar Dihukum 3 Tahun Plus Kerja Paksa
2022-01-04 08:49:07+00:00,sxhxxlx,RT Wahai peniaga tolong dengar nasihat Dr Noor Hisham henti bungkus nasi guna paku dawai kokot
2022-01-04 08:49:06+00:00,mumuk76,RT P4K Pada 3 Januari 2021 Plt Dirjen Pengelolaan Ruang Laut hadir sebagai narasumber dalam Green Talk di Berita S
2022-01-04 08:49:03+00:00,whiteaAlbum,Dari film zombie sama the bay sih gua han rata rata semuanya apatis kalau ada berita keganjilan di
2022-01-04 08:49:03+00:00,mnurilakbar,RT Polda Jabar harus profesional dan adil dalam memproses kasus pidana yang ditangani
2022-01-04 08:49:02+00:00,KPU_Surabaya,Rapat Refleksi dan Resolusi Bersama Sekretaris dan Staf Sekretariat KPU Surabaya
2022-01-04 08:49:01+00:00,republikaonline,Pembangunan jembatan ini akan menguntungkan China untuk antisipasi tentara India
2022-01-04 08:48:53+00:00,molfina14,RT zaki ketika pembahasan ceramah tentang KM 50 DIANGGAP berita bohong langsung masuk jadi TERSANGKA PADAHAL sudah JELAS ko
2022-01-04 08:48:51+00:00,publicanews,Korut Krisis Pangan Keluarga Pensiunan Tentara Pingsan Kelaparan
2022-01-04 08:48:51+00:00,anazman_,RT Pelantikan jawatan nombor dua pentadbiran negara itu berkemungkinan diadakan pada minggu hadapan AWANInews AWANI745 Kita
2022-01-04 08:48:49+00:00,DPR_RI,Rifqinizamy Usulan Kepolisian di Bawah Kementerian Belum Relevan
2022-01-04 08:48:47+00:00,wanzahidah,RT Tiada lagi walk in untuk dapatkan suntikan dos penggalak Protecthealth AWANInews AWANI745 Ha
2022-01-04 08:48:46+00:00,_muhammad_haziq,RT Pendiriannya itu mencetus tentangan daripada para pegawai Israel dan juga pujian daripada pengguna media sosial yang pro Pale
2022-01-04 08:48:42+00:00,jawapos,Banyak Saingan RSUD dr Darsono Belum Saatnya Naik Tipe B
2022-01-04 08:48:40+00:00,onassis_siregar,RT ipeh HBS langsung ditahan untuk 20 hari kedepan HBD di jerat Pasal 14 ayat 1 UU RI Nomor 1 Tahun 1946 Pasal itu berbunyi
2022-01-04 08:48:39+00:00,publicanews,2021 Myanmar Terburuk Kedua Dunia Memperlakukan Jurnalis
2022-01-04 08:48:38+00:00,hazealmaguri,nct cb lagi kapan mau nabung lagi keluar berita cbnya jgn mendadak kek tahu bulat dong
2022-01-04 08:48:29+00:00,tvstvmy,Saya hormati keputusan Cheng Hoe Ahmad Faizal Dapatkan berita terkini di Telegram
2022-01-04 08:48:28+00:00,DPR_RI,Dukung Pelaksanaan PTM di Sekolah Hetifah Tetap Waspada Omicron
2022-01-04 08:48:26+00:00,publicanews,Hapus Tatomu Karena Tidak Sesuai Nilai nilai Partai Komunis
2022-01-04 08:48:23+00:00,achmaadpauzi,RT Bhabinkamtibmas Polsek Teupah Barat Brigadir Miswandi dipuji gegara menjaga penjemuran gabah warga agar mau vaksinasi Dia ba
2022-01-04 08:48:23+00:00,NKRIndonesia79,Muslim Tasikmalaya Demo Minta Denny Siregar Ditangkap Jangan Sampai Kita yang Bert
2022-01-04 08:48:20+00:00,NusadailyCom,Pengacara Matinya Keadilan Bahar Smith Jadi Tersangka Kasus Berita Bohong
2022-01-04 08:48:17+00:00,rakyatmerdeka,Awali Lawan Persebaya Ini Jadwal Bali United Diputaran 2 Liga 1
2022-01-04 08:48:14+00:00,Suhailaxx1,RT Spekulasi tiga menteri bakal gugurkan daripada senarai jemaah kabinet sedang bertiup kencang ketika ini
2022-01-04 08:48:14+00:00,rakyatmerdeka,Di Depan Dubes Selandia Baru Moeldoko Blak blakan Soal Pendekatan Komprehensif Ke Papua
2022-01-04 08:48:13+00:00,opsiin,5 Center Grup K Pop Gen 4 Paling Penuh Pesona Termuda 17 Tahun GenSINDO Google Berita
2022-01-04 08:48:13+00:00,publicanews,Tidak Ada Tahun Baru di Ukraina Timur Hanya Granat dan Salju
2022-01-04 08:48:13+00:00,_FNDR,RT Anda tu jogja kok malah sibuk permasalahkan penggunaan kata klitih yg dianggap egk ada bahasa hukumnya Apa lupa y
2022-01-04 08:48:12+00:00,rakyatmerdeka,Resmikan GOR Setara Di Kalsel Menpora Ingin Batola Sumbang Atlet Berprestasi Dunia
2022-01-04 08:48:12+00:00,rakyatmerdeka,Liga Spanyol Baru Dikenalkan Barcelona Torres Malah Kepatil Covid
2022-01-04 08:48:11+00:00,drakkura_,Hmmm gue same nyari berita kemana mana
2022-01-04 08:48:11+00:00,rakyatmerdeka,Hadapi 2022 BGRLI Siapkan Jurus jurus Strategis
2022-01-04 08:48:10+00:00,rakyatmerdeka,Perkuat Benteng Pertahanan Persita Rekrut Bek Jebolan Liga 2
2022-01-04 08:48:09+00:00,opsiin,Aksi Kepepet Pemuda Masak dan Santap Mie Instan dari Wastafel Kamar Hotel Bikin Mual Google Berita
2022-01-04 08:48:09+00:00,opsiin,Bakal Rilis 2022 Insidious 5 Jadi Trending Topic di Twitter Google Berita
2022-01-04 08:48:08+00:00,opsiin,Singel Debut Kep1er Berjudul WA DA DA Jadi Trending Netizen di Forum Online dan Twitter Google Berita
2022-01-04 08:48:06+00:00,molfina14,RT Sehari Setelah Divaksin Siswa MI di Magetan Meninggal Dunia
2022-01-04 08:48:06+00:00,opsiin,Trending Jeongwoo Genjreng di Twitter Main Gitar Ini Lirik dan Chord Lagu Best Part yang Google Berita
2022-01-04 08:48:05+00:00,syarifptk,RT Partai Ummat diwakili oleh Refly Harun dan Denny Indrayana dalam judicial review
2022-01-04 08:48:04+00:00,DPR_RI,Sahroni Harap Direktorat PPA Mabes Polri Maksimalkan Penanganan Kasus Hukum Kekerasan Perempuan dan Anak
2022-01-04 08:48:03+00:00,keincaled,Jurusan Psikologi Binus menerbitkan buku berjudul Psikoteknologi Kontekstual
2022-01-04 08:48:03+00:00,Syamsud76579252,RT Ghibah adalah membicarakan aib atau keburukan atau rahasia orang lain
2022-01-04 08:48:03+00:00,VIVAcoid,Banjir Rendam 15 Kecamatan di Aceh Utara Dua Warga Meninggal
2022-01-04 08:48:02+00:00,tvOneNews,PTM 100 Persen Siswa dan Guru Wajib Check In PeduliLindungi
2022-01-04 08:48:01+00:00,irsyadadli02,RT Pendiriannya itu mencetus tentangan daripada para pegawai Israel dan juga pujian daripada pengguna media sosial yang pro Pale
2022-01-04 08:48:01+00:00,publicanews,Situs Palsu Penjual Perempuan Muslim India Ditutup Setelah Diprotes
2022-01-04 08:47:52+00:00,asjeplak,Jack Miller Menolak Disamakan dengan Casey Stoner
2022-01-04 08:47:50+00:00,Direktorat_P4K,Pada 3 Januari 2021 Plt Dirjen Pengelolaan Ruang Laut hadir sebagai narasumber dalam Green Talk di Beri
2022-01-04 08:47:48+00:00,publicanews,Pangeran Andrew Terancam Jadi Potensial Terdakwa Perdagangan Seks
2022-01-04 08:47:45+00:00,INDRAIRAWAN29,Habib Bahar cuma kasih penilaian atas peradilan kasus KM 50 masak berita bohong memangnya Habib Bahar menunju
2022-01-04 08:47:43+00:00,KhairulJmldn,RT isml NinjaVan dah mula masuk company yang guna logistik sebagai sumber utama Contohnya distributor rokok BAT lantik Nin
2022-01-04 08:47:43+00:00,MrJejal,RT Pendiriannya itu mencetus tentangan daripada para pegawai Israel dan juga pujian daripada pengguna media sosial yang pro Pale
2022-01-04 08:47:41+00:00,kaschner_sheila,RT Sehari Setelah Divaksin Siswa MI di Magetan Meninggal Dunia
2022-01-04 08:47:38+00:00,DPR_RI,Puan Maharani Semangat dan Daya Juang Pemain Tunjukkan Timnas Miliki Masa Depan Cerah
2022-01-04 08:47:37+00:00,SukitmanS,RT Cak Imin Dukung Ekspor Batu Bara Disetop Jangan Cuma Sebulan
2022-01-04 08:47:32+00:00,otosia,Apes Pemobil Pasrah Terjebak Macet Gara gara Pemotor Ramai ramai Lawan Arah Lalin Gara gara pemotor lawan arah ra
2022-01-04 08:47:29+00:00,aneukbiroe,RT Kinerja kepolisian dalam menangani kasus dugaan ujaran kebencian disorot publik
2022-01-04 08:47:26+00:00,voidotid,Dua remaja di Buleleng Bali baku hantam Videonya pun tersebar di media sosial
2022-01-04 08:47:23+00:00,Borexs51,RT Presiden menjadi tokoh terpopuler dan berpengaruh sepanjang 2021 nama beliau banyak dikutip media dan disebutka
2022-01-04 08:47:17+00:00,Shanghong20,RT Bahar Smith Ditetapkan Jadi Tersangka Kuasa Hukum Kami Menduga Ada Sponsor Dibelakang Semua Ini
2022-01-04 08:47:09+00:00,fransiskusjurin,RT Jalan Komplek Pendidikan Salemba Senen viral di media sosial lantaran rusak dan susah dilewati akibat adanya bekas proyek s
2022-01-04 08:47:08+00:00,palbapang1,RT Bahar Smith Ditetapkan Jadi Tersangka Kuasa Hukum Kami Menduga Ada Sponsor Dibelakang Semua Ini
2022-01-04 08:47:02+00:00,SukitmanS,RT GEMASABA Di sisi lain mendorong pemerintah mengoptimalkan Energi Baru Terbarukan EBT amp tidak sepenuhnya bergantung p
2022-01-04 08:47:01+00:00,voidotid,VIDEO Hal Ini yang Bisa Membuat Pria Penyewa Cassandra Angelie Bisa Dipidana
2022-01-04 08:46:52+00:00,republikaonline,Ghibah adalah membicarakan aib atau keburukan atau rahasia orang lain
2022-01-04 08:46:51+00:00,molfina14,RT Polda Jabar harus profesional dan adil dalam memproses kasus pidana yang ditangani
2022-01-04 08:46:46+00:00,umam_chaerul,RT Sehari Setelah Divaksin Siswa MI di Magetan Meninggal Dunia
2022-01-04 08:46:44+00:00,syaafikhh,RT BERITA TERKINI Ada perempuan feminist panggil Allah SWT dengan ganti nama She bukan He Ini dah cukup melampau kera
2022-01-04 08:46:43+00:00,soen_cak,Si Eko boy ini bukannya yg dulu nyebar hoax server KPU ya
2022-01-04 08:46:39+00:00,KoranTEGAL,RT Aturan naik kereta kembali menggunakan SE Kemenhub RI Nomor 97 Tahun 2021
2022-01-04 08:46:39+00:00,broz6969,RT Tali yang digunakan untuk menunda kapal tersebut telah terputus menyebabkan kapal tanpa kru itu hanyut hingga memasuki per
2022-01-04 08:46:36+00:00,molfina14,RT Kinerja kepolisian dalam menangani kasus dugaan ujaran kebencian disorot publik
2022-01-04 08:46:34+00:00,sayfulhaq29,Sebenernya striker Benfica juga bagus tapi berita paling update sih Alexander Isak dia gaya main nya
2022-01-04 08:46:25+00:00,harithnurhaq,RT Pendiriannya itu mencetus tentangan daripada para pegawai Israel dan juga pujian daripada pengguna media sosial yang pro Pale
2022-01-04 08:46:25+00:00,republikaonline,Angka kemiskinan di Kota Batam pada Maret 2021 mencapai 5 05 persen
2022-01-04 08:46:22+00:00,airasyrfn,RT Pendiriannya itu mencetus tentangan daripada para pegawai Israel dan juga pujian daripada pengguna media sosial yang pro Pale
2022-01-04 08:46:20+00:00,hanipp_rmln,RT Tiada lagi walk in untuk dapatkan suntikan dos penggalak Protecthealth AWANInews AWANI745 Ha
2022-01-04 08:46:16+00:00,republikaonline,Ini merupakan bentuk komitmen BRI dalam memberikan layanan dan solusi terintegrasi
2022-01-04 08:46:14+00:00,Ilhm141,Nama2 yg disebutkan ga ada yg berbobot Ada Riza dan Sahroni Ini Kandidat Gubernur Jakarta Pengganti Anies
2022-01-04 08:46:13+00:00,Kec_Tebet,Kebakaran rumah di Jalan Casablanca Menteng Dalam Tebet Jakarta Selatan terjadi pada Senin 3 Januari 2022 sek
2022-01-04 08:46:02+00:00,Naufalvsthewrld,RT Ratusan kenderaan dilihat berhenti di jalan raya ketika orang ramai mahu menikmati cuaca luar biasa di kawasan berdekatan sem
2022-01-04 08:46:02+00:00,omlaedo,RT ferry Menyelesaikan masalah dengan meninggalkan masalah baru Tanggung jawab siapa Pemprov DKI atau Kontraktor Sumur Resapan
2022-01-04 08:46:00+00:00,sukajalanterus,RT Saat ini harga telur ayam sudah berangsur turun dari Rp 32 000 kg dan saya targetkan menjadi Rp 27 000 kg di wilayah Jak
2022-01-04 08:45:59+00:00,iskandarhelmi47,Makin Diminati 2021 KMT Catat Rekor Terjual Lebih dari 2 Juta Kartu
2022-01-04 08:45:58+00:00,republikaonline,Investasi BPKH pada Bank Muamalat didasari pertimbangan bisnis
2022-01-04 08:45:56+00:00,JembzCoeey,RT Hadiri istigosah di Ponpes Amanatul Ummah mentri BUMN Erick Thohir ajak santri utk kembangkan ekonomi kreatif Iyes pak
2022-01-04 08:45:54+00:00,DPR_RI,Misbakhun Optimis Target Penerimaan Pajak 2022 Bisa Tercapai
2022-01-04 08:45:51+00:00,Kelingatan,RT Anda tu jogja kok malah sibuk permasalahkan penggunaan kata klitih yg dianggap egk ada bahasa hukumnya Apa lupa y
2022-01-04 08:45:51+00:00,luqman78,RT IPW menilai Polda Jabar perlu mencopot penyidik kasus kasus yang mangkrak
