waktu,username,text2022-01-04 09:18:16+00:00,idinzainuddin,RT Kinerja kepolisian dalam menangani kasus dugaan ujaran kebencian disorot publik
2022-01-04 09:18:13+00:00,realang_,Berita duka hari ini tbtb ibukku masuk kamar dn ngasi tau kl ayamnya mati 2 krn lampunya aku matiin maap maap
2022-01-04 09:18:10+00:00,lapas2btanjung,RESMI 100 ASN 4 ORANG CPNS LAPAS TANJUNG DILANTIK MENJADI PNS SELENGKAPNYA gt gt gt gt gt gt
2022-01-04 09:18:05+00:00,mirul_acap1117,RT Pendiriannya itu mencetus tentangan daripada para pegawai Israel dan juga pujian daripada pengguna media sosial yang pro Pale
2022-01-04 09:18:04+00:00,Riau1Official,Perubahan Perda Tata Kelola BUMN di Riau Berikut Penjelasan Dewan
2022-01-04 09:18:04+00:00,UGMYogyakarta,Mahasiswa UGM Raih Juara I Lomba Debat Bahasa Nasional
2022-01-04 09:18:03+00:00,GoRiauCom,SMP di Pekanbaru Mulai Tatap Muka Selama 6 Jam Sehari
2022-01-04 09:17:54+00:00,Banyu_Biru01,RT Sehari Setelah Divaksin Siswa MI di Magetan Meninggal Dunia
2022-01-04 09:17:53+00:00,republikaonline,Disdik DKI perlu mengakomodir orang tua yang masih belum izinkan anaknya untuk PTM
2022-01-04 09:17:51+00:00,Nurizal,RT Ahli Pastikan 6 Laskar FPI Korban Unlawful Killing Tewas Tertembak
2022-01-04 09:17:46+00:00,republikaonline,Setiap Muslim harus segera bertaubat setelah melakukan dosa
2022-01-04 09:17:44+00:00,Fredy_Santana01,RT Innalillahi wa innalillahi Rajiun Tidak kaget sebenarnya mendengar berita ini karena sudah diprediksi akan seperti ini
2022-01-04 09:17:41+00:00,TheGadisPilah,RT Tiada lagi walk in untuk dapatkan suntikan dos penggalak Protecthealth AWANInews AWANI745 Ha
2022-01-04 09:17:40+00:00,ina2global_,Presiden Republik Indonesia Joko Widodo mengucapkan terima kasih kepada Indonesia atas segala pencapaiannya di tahu
2022-01-04 09:17:33+00:00,inewsdotid,24 Kabupaten Kota di Jatim Gelar PTM 100 Persen Gubernur Khofifah Wajib Prokes Ketat PTM khofifah
2022-01-04 09:17:28+00:00,dorseysilalahi,RT Dipimpin ternyata warga DKI gak bahagia
2022-01-04 09:17:28+00:00,zefanyaam,Sumber 1 Keputusan Bersama Menteri 2 Kemendikbud Vaksinasi Anak Bukan Syarat Sekola
2022-01-04 09:17:26+00:00,jjsengui,RT cak Si Eko boy ini bukannya yg dulu nyebar hoax server KPU ya
2022-01-04 09:17:26+00:00,zefanyaam,Apabila Pihak Penyelenggara Pendidikan anak anda bahkan TIDAK MAMPU SECARA BENAR Mengkaji rumor berita yang beredar
2022-01-04 09:17:26+00:00,wahyuyl,RT Yg jadi petanyaan Data dari mana sih itu Padahal sudah ada beberapa orang yang ditangkap dan diproses secara
2022-01-04 09:17:23+00:00,JPenerangan,RT Berita TanahMendap Polis tutup Jalan Kinabalu dari arah Cheras
2022-01-04 09:17:22+00:00,siticeriaselalu,Faktor penyebab kenaikan level ppkm itu lebih ke masalah teknis saja misal prosentase vaksinasi yg masih rendah S
2022-01-04 09:17:21+00:00,VirtualThumb,GOBLOG HA HA HA NGELES ADA ANAK MATI KARENA VAKSINASI PERCAYA BERITA ANAK MATI KARENA KESELEG BAKSO PE
2022-01-04 09:17:17+00:00,rawayan78,RT didu PHK tenaga Iptek berlanjut Setelah Eijkman skrg kapal riset Infonya hal yg sama sedang terjadi di BPPT LAPAN dan BATAN
2022-01-04 09:17:09+00:00,Siennakuy,ri Awali hari dengan baca berita update
2022-01-04 09:17:08+00:00,irdatnh,RT Sejumlah pihak membandingkan penanganan kasus Denny dan Habib Bahar
2022-01-04 09:17:07+00:00,Hafizah_AH,RT Pendiriannya itu mencetus tentangan daripada para pegawai Israel dan juga pujian daripada pengguna media sosial yang pro Pale
2022-01-04 09:17:01+00:00,jawapos,Bahar Smith Ditahan setelah Jadi Tersangka Penyebar Berita Bohong
2022-01-04 09:16:57+00:00,NazmiHanafiah,RT Tiada lagi walk in untuk dapatkan suntikan dos penggalak Protecthealth AWANInews AWANI745 Ha
2022-01-04 09:16:56+00:00,arifhidayat,Penceramah BS dan Penyebar Video Ditetapkan Tersangka dan Ditahan
2022-01-04 09:16:54+00:00,sumbawanews,Penceramah BS dan Penyebar Video Ditetapkan Tersangka dan Ditahan
2022-01-04 09:16:54+00:00,budakfrontdev,RT Pendiriannya itu mencetus tentangan daripada para pegawai Israel dan juga pujian daripada pengguna media sosial yang pro Pale
2022-01-04 09:16:49+00:00,nyonyacyber,RT Berita TanahMendap Polis tutup Jalan Kinabalu dari arah Cheras
2022-01-04 09:16:49+00:00,heavenghost,Gue jadi inget berita sex doll lepas di laut terus dikira bidadari
2022-01-04 09:16:44+00:00,wahyuyl,RT Yg paling lucu dari ini semua Bahar dateng dgn jumawa dan PD bak pahlawan dikawal ratusan orang pengacara juga sdh
2022-01-04 09:16:42+00:00,Adit_ciper,RT Ceramah menuduh Polri membunuh 6 FPI pengawal Rizieq Difitnah dgn keji dgn kata Dibunuh disiksa dikuliti dicabut k
2022-01-04 09:16:36+00:00,detikcom,Israel melaporkan temuan kasus infeksi gabungan virus influenza dengan virus Corona Flurona Disorot Kementerian
2022-01-04 09:16:26+00:00,alyssataufid,RT fadzil Sikap berdiam diri SPRM Azam akan jadi nanah dalam organisasi Astro Awani
2022-01-04 09:16:25+00:00,JanganJadiPaok,Bentar lagi beritanya Tegas Bobby minta pelaku ditangkap Pelaku pembegalan tertangkap
2022-01-04 09:16:20+00:00,burungpipit74,RT Ternyata sumur resapan DKI masih meninggalkan mslh kupikir sdh selesai pdhal hanya tinggal membersihkan sisa2 proyek hrs n
2022-01-04 09:16:05+00:00,republikaonline,Apindo menilai SK Gubernur tidak memiliki dasar hukum yang jelas
2022-01-04 09:16:03+00:00,Sena_Dinata,Asmara1701 Baca berita nya jangan tanya saya tinggal dimana lokasi yang say
2022-01-04 09:16:00+00:00,GRindiyadi,RT Kasus Denny Siregar di Polda Jabar sudah berjalan lebih dari satu tahun
2022-01-04 09:15:51+00:00,saluran123rtm,RT 4 Januari Tangguh ibadah umrah gambaran sebenar risiko COVID 19 dibincangkan dalam mesyuarat khas kabinet esok
2022-01-04 09:15:46+00:00,WieahOpss,RT Pendiriannya itu mencetus tentangan daripada para pegawai Israel dan juga pujian daripada pengguna media sosial yang pro Pale
2022-01-04 09:15:44+00:00,idinzainuddin,RT Polda Jabar harus profesional dan adil dalam memproses kasus pidana yang ditangani
2022-01-04 09:15:41+00:00,salehug,RT Kinerja kepolisian dalam menangani kasus dugaan ujaran kebencian disorot publik
2022-01-04 09:15:41+00:00,NinjaCir3ng,RT blues 1 Vaksinasi booster covid 19 di Indonesia akan dimulai pada tgl 12 Januari 2022 dan diberikan hanya utk orang dewasa di
2022-01-04 09:15:39+00:00,Galih_Akek2,RT Yg jadi petanyaan Data dari mana sih itu Padahal sudah ada beberapa orang yang ditangkap dan diproses secara
2022-01-04 09:15:38+00:00,En_Blue_Bird,RT Kerja pembaikan oleh DBKL dijangka mengambil masa dua atau tiga hari AWANInews AWANI745 Banjir2021
2022-01-04 09:15:36+00:00,arifhidayat,Seorang Buron Anggota MIT Poso Tewas Dalam Kontak Tembak
2022-01-04 09:15:36+00:00,detikfinance,Eks CEO Bukalapak Rachmat Kaimuddin resmi bergabung dengan Kemenko Kemaritiman dan Investasi pimpinan Luhut Binsar
2022-01-04 09:15:34+00:00,p3nz0t,RT Yg paling lucu dari ini semua Bahar dateng dgn jumawa dan PD bak pahlawan dikawal ratusan orang pengacara juga sdh
2022-01-04 09:15:34+00:00,SundariTatat,RT santik4 Masih belum bisa mup on dari berita Jaksa Agung yg memberi apresiasi tinggi kepada Menteri BUMN Erick Thohir atas kon
2022-01-04 09:15:33+00:00,sumbawanews,Seorang Buron Anggota MIT Poso Tewas Dalam Kontak Tembak
2022-01-04 09:15:33+00:00,matakitaco,Ketua Bapera Kota Gorontalo Mempertanyakan Kapan Di P21 Persoalan Hukum Bagi Tersangka AD
2022-01-04 09:15:32+00:00,antarabiz,Yuan digital kian populer di tengah uji coba penggunaan yang lebih luas
2022-01-04 09:15:28+00:00,jawapos,Pemkab Ponorogo Turunkan Tim Teliti Titik Perbaikan Jalan yang Didanai PEN
2022-01-04 09:15:24+00:00,fhrmsr,RT Pendiriannya itu mencetus tentangan daripada para pegawai Israel dan juga pujian daripada pengguna media sosial yang pro Pale
2022-01-04 09:15:21+00:00,abcdefghanis_,RT BERITA TERKINI Ada perempuan feminist panggil Allah SWT dengan ganti nama She bukan He Ini dah cukup melampau kera
2022-01-04 09:15:20+00:00,irdatnh,RT Kinerja kepolisian dalam menangani kasus dugaan ujaran kebencian disorot publik
2022-01-04 09:15:06+00:00,wow_keren,Netizen Tanggapi Respons Jin BTS Soal Harga Merchandise yang Dinilai Kemahalan Jin
2022-01-04 09:15:03+00:00,wow_keren,RM dan Jin BTS Dinyatakan Sembuh Total dari COVID 19 BangtanBoys RapMonster Jin
2022-01-04 09:15:00+00:00,kompascom,Tak hanya Bahar bin Smith yang dijadikan tersangka Polisi juga menetapkan TR pengunggah video ceramah Bahar yang
2022-01-04 09:14:59+00:00,berita_gempa,Seseorang yang ingin mendalami ajaran Tasawwuf maka terlebih dahulu mesti mendalami dan memahami ajaran Syariat
2022-01-04 09:14:59+00:00,cahyowib,Kalau bikin berita utamakan Pembacanya jgn asal ngerti sendiri BRIN itu apa
2022-01-04 09:14:51+00:00,clarayusna,Mahfud Md Tegaskan Pemerintah Serius Tuntaskan Kasus HAM Berat di RI
2022-01-04 09:14:50+00:00,MeorEchie,RT Berita gembira untuk pengumpul topi Lepasni dah boleh cuci topi korang guna cover topi ni and campak dalam washin
2022-01-04 09:14:47+00:00,yoppipis,RT Ahli Pastikan 6 Laskar FPI Korban Unlawful Killing Tewas Tertembak
2022-01-04 09:14:46+00:00,BernamaTV,Berita TanahMendap Polis tutup Jalan Kinabalu dari arah Cheras
2022-01-04 09:14:43+00:00,Ronin708103553,RT Ketua KPK Firli Bahuri Prihatin Ada 22 Gubernur Terjerat Kasus Korupsi Tak usah muluk napa Satu Gubernur saja dibia
2022-01-04 09:14:41+00:00,Syamsud76579252,RT Para dai diminta agar berdakwah sesuai dengan pedoman dakwah Islam wasathiyah
2022-01-04 09:14:30+00:00,Hilmy29288894,BuzzerRp mulai gaduh di medsos krna ada kegaduhan maka dilaporkan ke polisi HRS dipanggil polisi dan langsung di
2022-01-04 09:14:30+00:00,ohmnnnbigwin,Gatau mau ngomong apa sama berita nya pwt
2022-01-04 09:14:29+00:00,momsquad02,RT Kinerja kepolisian dalam menangani kasus dugaan ujaran kebencian disorot publik
2022-01-04 09:14:28+00:00,Syamsud76579252,RT Dokter Novia ungkapkan bahwa ia menemukan beberapa luka lecet dan luka lebam di beberapa bagian tubuh terdakwa Briptu Fikri
2022-01-04 09:14:25+00:00,monitorindo,Fakultas Sastra dan Bahasa UKI Gelar Bakti Sosial untuk Masyarakat Mentawai dan Nias ikafasas baksos sastrauki
2022-01-04 09:14:23+00:00,aryfa18,RT Kinerja kepolisian dalam menangani kasus dugaan ujaran kebencian disorot publik
2022-01-04 09:14:18+00:00,AnisAliaaaa,RT Berita gembira untuk pengumpul topi Lepasni dah boleh cuci topi korang guna cover topi ni and campak dalam washin
2022-01-04 09:14:17+00:00,novsihite,RT Riyadh dituduh membantu menyebarkan ideologi Islam ekstremis di seluruh dunia
2022-01-04 09:14:15+00:00,BeritaBaru,Kelompok milenial apresiasi langkah cepat Polri atasi pelaku intoleran BeritaBaru
2022-01-04 09:14:14+00:00,Galih_Akek2,RT Ternyata sumur resapan DKI masih meninggalkan mslh kupikir sdh selesai pdhal hanya tinggal membersihkan sisa2 proyek hrs n
2022-01-04 09:14:11+00:00,sikapiuangmu,Wah ada berita terbaru nih Katanya kredit usaha rakyat dimudahkan dengan bunga 6 Jadi berapa sih nilai plafon
2022-01-04 09:14:10+00:00,Didik_1923,RT Kinerja kepolisian dalam menangani kasus dugaan ujaran kebencian disorot publik
2022-01-04 09:14:04+00:00,HukumTaat,RT HAARP in action Brrrrrrr Embun Es Turun Dieng Membeku Pagi Ini
2022-01-04 09:14:01+00:00,501Awani,Kesiapsiagaan setempat melalui kemuafakatan komuniti ini amat penting disediakan dengan penglibatan setiap lapisan
2022-01-04 09:13:53+00:00,Galih_Akek2,RT Memasuki tahun terakhir masa bakti dia akan banyak melakukan langkah seperti ini Perlu utk bernostalgia amp membangkitk
2022-01-04 09:13:53+00:00,PoskotaCo,Sekdes Beri Hadiah Ultah Anaknya Mobil Rubicon Alpard dan HR V Kunjungi
2022-01-04 09:13:49+00:00,01_2020_,RT Sehari Setelah Divaksin Siswa MI di Magetan Meninggal Dunia
2022-01-04 09:13:45+00:00,frxhah,RT BERITA TERKINI Ada perempuan feminist panggil Allah SWT dengan ganti nama She bukan He Ini dah cukup melampau kera
2022-01-04 09:13:41+00:00,voidotid,YouTube dilihat masyarakat dan dilaporkan oleh seseorang berinisial TNA ke Polda Metro Jaya pada 17 Desember 2021
2022-01-04 09:13:40+00:00,Yochiyoshimyb00,Kece bgt masuk berita
2022-01-04 09:13:40+00:00,hadizalhe,RT Pelantikan jawatan nombor dua pentadbiran negara itu berkemungkinan diadakan pada minggu hadapan AWANInews AWANI745 Kita
2022-01-04 09:13:39+00:00,uselessiamyam,RT Sebuah rumah mewah di Perumahan Vila Pamulang Kota Tangsel menjadi tempat vandalisme Polisi mengungkapkan rumah itu miliki
2022-01-04 09:13:33+00:00,ArSunantoaris,RT Akhirnya pemecah belah bangsa di tahan juga Betapa leganya mendengar beritanya semua bahagia
2022-01-04 09:13:28+00:00,4di53tiavv,RT Issue Contoh judul berita 1 HP nya Si otong dipake maen game ML di kamar Contoh judul berita 2 Si entin menghisap eskri
2022-01-04 09:13:28+00:00,termosbirumuda,menace69 Aku SS pas ada berita artis2 pd punya bayi buatan yg mirip dgn diri mrk di waktu kecil
2022-01-04 09:13:25+00:00,kodim0416bungo1,Menggunakan Perahu Persit KCK Cabang XXIV Dim 0416 Salurkan Air Mineral dan Makanan
2022-01-04 09:13:23+00:00,ratu12noer,RT Innalillahi wa innalillahi Rajiun Tidak kaget sebenarnya mendengar berita ini karena sudah diprediksi akan seperti ini
2022-01-04 09:13:21+00:00,OhhNiesa,RT Pendiriannya itu mencetus tentangan daripada para pegawai Israel dan juga pujian daripada pengguna media sosial yang pro Pale
2022-01-04 09:13:20+00:00,aaminmsrn,RT Pendiriannya itu mencetus tentangan daripada para pegawai Israel dan juga pujian daripada pengguna media sosial yang pro Pale
2022-01-04 09:13:19+00:00,nyonyacyber,RT Kerajaan akan menanggung kos urusan kuarantin termasuk makan minum dan pengangkutan dari lapangan terbang bagi jemaah umr
2022-01-04 09:13:19+00:00,msyandi888,RT Kinerja kepolisian dalam menangani kasus dugaan ujaran kebencian disorot publik
2022-01-04 09:13:17+00:00,Kemenkumham_Jbr,BERITA UTAMA KABID HAM HASBULLLAH SERAHKAN DRAF REVISI KEPUTUSAN GUBERNUR KE KADISDIK PROV JAWA BARAT
2022-01-04 09:13:15+00:00,Garbageilo,RT Bahar Smith Ditetapkan Jadi Tersangka Kuasa Hukum Kami Menduga Ada Sponsor Dibelakang Semua Ini
2022-01-04 09:13:13+00:00,KapanLagicom,9 Potret Keluarga Ashanty dan Gen Halilintar Naik Wahana di Turki Arsy Alami Kecelakaan dan Pipinya Terluka
2022-01-04 09:13:11+00:00,SKakilima,prabu id Bong judul berita itu bukan data
2022-01-04 09:13:09+00:00,KapanLagicom,8 Potret Gaga Muhammad Hadiri Sidang Lanjutan Kasusnya Irit Bicara Usai Dituntut 4 Tahun 6 Bulan Penjara
2022-01-04 09:13:09+00:00,IlysStory,RT Tiada lagi walk in untuk dapatkan suntikan dos penggalak Protecthealth AWANInews AWANI745 Ha
2022-01-04 09:13:07+00:00,KapanLagicom,9 Potret Samar Anaya Putri Semata Wayang Masayu Anastasia dan Lembu Makin Cantik di Usia Beranjak Remaja
2022-01-04 09:13:05+00:00,KapanLagicom,Ungkap Keresahannya Danilla Riyadi Tuangkan Sikap Bodo Amat Lewat Lagu MPV
2022-01-04 09:13:05+00:00,AkhmadDimyati13,RT Kasus Denny Siregar di Polda Jabar sudah berjalan lebih dari satu tahun
2022-01-04 09:13:03+00:00,bernamadotcom,Berita TanahMendap Polis tutup Jalan Kinabalu dari arah Cheras
2022-01-04 09:13:03+00:00,KapanLagicom,7 Potret Fuji yang Tutupi Bagian Dadanya Saat Berfoto Bersama Chika Sikapnya Dinilai Sopan dan Banjir Pujian
2022-01-04 09:13:00+00:00,FAM_Malaysia,Taklimat Local General Coordinator LGC MPFL 2022 4 Januari 2022 Baca berita penuh di
2022-01-04 09:12:58+00:00,muhammadhaf1z,RT Kerja pembaikan oleh DBKL dijangka mengambil masa dua atau tiga hari AWANInews AWANI745 Banjir2021
2022-01-04 09:12:55+00:00,ibra_ajikadabra,RT Kinerja kepolisian dalam menangani kasus dugaan ujaran kebencian disorot publik
2022-01-04 09:12:54+00:00,AlayBerisik,RT 003 Setiap berita om icron lewat diledekin netizen Hmm sepertinya elite global lokal bakalan gagal deh ciptakan narasi ketak
2022-01-04 09:12:50+00:00,reonne25,Tp baru 2 hari doang ditinggal dah ktinggalan aje berita sekecamatan
2022-01-04 09:12:43+00:00,tvstvmy,Wartawan akhbar Cina ditemukan mati dalam kereta Dapatkan berita terkini di Telegram
2022-01-04 09:12:40+00:00,AgngFms,Dan bener rezeki tuh bukan tntng uang aja ya wlwpun dpt krja menghasilkan uang tp dpt berita bahagia engga di d
2022-01-04 09:12:38+00:00,moharyz,RT Wahai peniaga tolong dengar nasihat Dr Noor Hisham henti bungkus nasi guna paku dawai kokot
2022-01-04 09:12:35+00:00,imanlagi,Hmmm kok jadi rame urusan pilkada
2022-01-04 09:12:32+00:00,kodim0416bungo1,Wujudkan kemanunggalan TNI Rakyat Danramil 02 Tanah Tumbuh Laksanakan Komsos dengan Warga
2022-01-04 09:12:31+00:00,MRTMalaysia,Berita Harian Projek MRT LRT pemangkin pertumbuhan pasca pandemik
2022-01-04 09:12:28+00:00,detikcom,Preeklampsia memang menjadi salah satu kondisi yang harus diwaspadai saat hamil Sebab kondisi ini dapat membahayak
2022-01-04 09:12:27+00:00,hebikurajj11,RT Berita tidak selalu sama dengan kenyataan
2022-01-04 09:12:23+00:00,MJtuhMasJoko,RT ali7 Habib Bahar ditahan mudah diprediksi jaga Jempol kalian ya sob rezim ini Tanpa saya harus jelaskan panjang lebar ka
2022-01-04 09:12:23+00:00,detikHealth,Indonesia melaporkan 299 kasus COVID 19 pada Selasa 4 1 2022 Total kasus positif menjadi 4 263 732 sembuh 4 114
2022-01-04 09:12:21+00:00,asjeplak,8 Gejala Ini Bisa Muncul dalam 3 Hari Setelah Terinfeksi Omicron
2022-01-04 09:12:14+00:00,ESupriatna20,RT Innalillahi wa innalillahi Rajiun Tidak kaget sebenarnya mendengar berita ini karena sudah diprediksi akan seperti ini
2022-01-04 09:12:13+00:00,LsmSapulidi,RT Anies Baswedan bernostalgia dengan makan di sebuah warteg di kawasan Ancol Jakarta Utara Anies makan di warteg yang fotonya
2022-01-04 09:11:57+00:00,Nugroho99036078,RT Ceramah menuduh Polri membunuh 6 FPI pengawal Rizieq Difitnah dgn keji dgn kata Dibunuh disiksa dikuliti dicabut k
2022-01-04 09:11:57+00:00,JailJali,RT Mohon Bantuan kepada rekan rekan Berita Orang Hilang atas nama Nama Sukri Umur 71 thn Alamat Sipelem Rt 21 Rw 6 D
2022-01-04 09:11:56+00:00,antaranews,Dokter Novia ungkapkan bahwa ia menemukan beberapa luka lecet dan luka lebam di beberapa bagian tubuh terdakwa Brip
2022-01-04 09:11:54+00:00,Fitridayantri,RT Akhirnya pemecah belah bangsa di tahan juga Betapa leganya mendengar beritanya semua bahagia
2022-01-04 09:11:48+00:00,dirtydust_,sebab kita sendiri dah banyak sangat baca berita pemandu lori mabuk dadah haritu kes lapan beranak mati sekelipma
2022-01-04 09:11:47+00:00,aimanthemacho,RT Tiada lagi walk in untuk dapatkan suntikan dos penggalak Protecthealth AWANInews AWANI745 Ha
2022-01-04 09:11:42+00:00,501Awani,Kerja pembaikan oleh DBKL dijangka mengambil masa dua atau tiga hari AWANInews AWANI745 Banjir2021
2022-01-04 09:11:34+00:00,hji__hni,RT Pendiriannya itu mencetus tentangan daripada para pegawai Israel dan juga pujian daripada pengguna media sosial yang pro Pale
2022-01-04 09:11:31+00:00,republikaonline,Para dai diminta agar berdakwah sesuai dengan pedoman dakwah Islam wasathiyah
2022-01-04 09:11:29+00:00,Emsubhi1,RT Kinerja kepolisian dalam menangani kasus dugaan ujaran kebencian disorot publik
2022-01-04 09:11:23+00:00,petanirumah,RT Hidroponik menghemat air dan tanah dan bisa menghasilkan produk yang baik
2022-01-04 09:11:16+00:00,EricKeshav,RT Menurut Ismail Sabri fokus utama kerajaan ketika ini adalah untuk mempercepatkan bantuan kepada mangsa yang terjejas dengan
2022-01-04 09:11:14+00:00,najaizzati,RT Tiada lagi walk in untuk dapatkan suntikan dos penggalak Protecthealth AWANInews AWANI745 Ha
2022-01-04 09:11:13+00:00,ahmadfirdauslah,RT Pelantikan jawatan nombor dua pentadbiran negara itu berkemungkinan diadakan pada minggu hadapan AWANInews AWANI745 Kita
2022-01-04 09:11:13+00:00,ghastpiracy,RT Anda tu jogja kok malah sibuk permasalahkan penggunaan kata klitih yg dianggap egk ada bahasa hukumnya Apa lupa y
2022-01-04 09:11:13+00:00,dhon3adi,RT Ahli Pastikan 6 Laskar FPI Korban Unlawful Killing Tewas Tertembak
2022-01-04 09:11:12+00:00,EricKeshav,RT Saman difailkan pengundi itu membabitkan Langkah Sheraton AWANInews AWANI745
2022-01-04 09:11:09+00:00,NusaDirga,Santer berita omicron udah nyebar kemana2 tp ptm 100 bingung kan
2022-01-04 09:11:09+00:00,tvOneNews,Tertipu Pembelian Perumahan Berkedok Syariah Puluhan Korban Datangi SPKT Polda Jatim
2022-01-04 09:11:07+00:00,tvOneNews,Dokter yang Mengaku Bisa Netralkan Darah Pecandu Narkoba di Cianjur Pasang Tarif 10 Juta Sekali Suntik
2022-01-04 09:11:06+00:00,rigmaloringan,RT Meskipun harga batu bara di Luar Negeri menggila Presiden Jokowi keras dan tegas melarang ekspor batu bara selama bulan Jan
2022-01-04 09:11:06+00:00,callme_temon,RT Inflasi Turki secara tahunan berada di level tertinggi dalam 19 tahun Hal ini menjadi peringatan atas kebijakan presidennya
2022-01-04 09:11:06+00:00,y_mitasv,suandi Klo IG ga prlu on jg gpp klo twitter jg ga bs sih sumber berita wkwk
2022-01-04 09:11:05+00:00,tvOneNews,PTM 100 Persen Dimulai Ini Kendala yang Dihadapi Sekolah
2022-01-04 09:11:04+00:00,_s0hcaht0a,RT Pengeluaran KWSP setiap kali bencana bukan tindakan bijak NUBE AWANInews AWANIpagi
2022-01-04 09:11:04+00:00,republikaonline,Eri juga meminta tidak ada lagi lurah yang yang susah dihubungi warganya
2022-01-04 09:10:50+00:00,SkuterEvo,RT Kira kira 34 unit rumah di kawasan Hulu Langat yang dikenal pasti musnah atau rosak teruk akibat kejadian banjir bakal menerim
2022-01-04 09:10:42+00:00,yadhiyadhiyadhi,RT Anda tu jogja kok malah sibuk permasalahkan penggunaan kata klitih yg dianggap egk ada bahasa hukumnya Apa lupa y
2022-01-04 09:10:41+00:00,ahm4dz4in,RT Kasus Denny Siregar di Polda Jabar sudah berjalan lebih dari satu tahun
2022-01-04 09:10:37+00:00,Syamsud76579252,RT Pada Juni 1997 pencuri masuk dan mencuri mobil ini langsung
2022-01-04 09:10:36+00:00,tama_milanisti,RT Ahli Pastikan 6 Laskar FPI Korban Unlawful Killing Tewas Tertembak
2022-01-04 09:10:36+00:00,TiyusAe,Dewan Pimpinan Pusat Ikatan Mahasiswa Muhammadiyah DPP IMM mendukung Kepolisian Daerah Jawa Barat Polda Jabar m
2022-01-04 09:10:34+00:00,jaybnever_hr,si males baca beritaaaa wkwkw mesti banyakin baca berita sih soalnya bakal sering ketemu org2 sebidang yg tiba2 ng
2022-01-04 09:10:27+00:00,Iseng57185173,RT Innalillahi wa innalillahi Rajiun Tidak kaget sebenarnya mendengar berita ini karena sudah diprediksi akan seperti ini
2022-01-04 09:10:24+00:00,KDeddi135,RT Ternyata sumur resapan DKI masih meninggalkan mslh kupikir sdh selesai pdhal hanya tinggal membersihkan sisa2 proyek hrs n
2022-01-04 09:10:21+00:00,sidr_net,RT zaki ketika pembahasan ceramah tentang KM 50 DIANGGAP berita bohong langsung masuk jadi TERSANGKA PADAHAL sudah JELAS ko
2022-01-04 09:10:21+00:00,antarasumbar,Seorang DPO tewas dalam kontak tembak dengan Satgas Madago Raya
2022-01-04 09:10:21+00:00,Sena_Dinata,Asmara1701 Anda kurang baca berarti padahal tinggal cek berita aja gak
2022-01-04 09:10:19+00:00,Generasikuat,RT Akhirnya pemecah belah bangsa di tahan juga Betapa leganya mendengar beritanya semua bahagia
2022-01-04 09:10:18+00:00,AsepRus04734801,RT Dino mengaku mendapat ancaman pembunuhan usai membongkar kasus mafia tanah
2022-01-04 09:10:18+00:00,republikaonline,Pada Juni 1997 pencuri masuk dan mencuri mobil ini langsung
2022-01-04 09:10:16+00:00,Astra_Abadi,RT Kasus Denny Siregar di Polda Jabar sudah berjalan lebih dari satu tahun
2022-01-04 09:10:15+00:00,yynnilawty,please 2022 bawa berita baik ya kali ini semoga datang dari diri sendiri
2022-01-04 09:10:13+00:00,Iseng57185173,RT ipeh HBS langsung ditahan untuk 20 hari kedepan HBD di jerat Pasal 14 ayat 1 UU RI Nomor 1 Tahun 1946 Pasal itu berbunyi
2022-01-04 09:10:12+00:00,pajedu,RT 7 anggota Resmob diduga terlibat dalam pembantaian 6 Laskar FPI Dalam melaksanakan tiga surat perintah Briptu Fikri Ramadhan
2022-01-04 09:10:11+00:00,myrazra,RT Kasus Denny Siregar di Polda Jabar sudah berjalan lebih dari satu tahun
2022-01-04 09:10:09+00:00,aprilianel,ada pulsa 100rb buat 20orang Ajak Teman follow DennyJA WORLD dapatkan Kisah Inspiratif Berita Tips amp Poll
2022-01-04 09:10:07+00:00,HarlenRahardian,RT Yg paling lucu dari ini semua Bahar dateng dgn jumawa dan PD bak pahlawan dikawal ratusan orang pengacara juga sdh
2022-01-04 09:10:06+00:00,DPP_GARDABMI,RT GusMuhaimin mendorong pemerintah mengoptimalkan Energi Baru Terbarukan EBT amp tidak sepenuhnya bergantung pada energi
2022-01-04 09:09:58+00:00,minerva_rin,Artikel yg w pilih buat kerkel itu Cagar Biosfer Lore Lindu Setiap paragraf membuat ku kagum bikin ku semakin sad
2022-01-04 09:09:57+00:00,NabilHussein,RT Berita gembira untuk pengumpul topi Lepasni dah boleh cuci topi korang guna cover topi ni and campak dalam washin
2022-01-04 09:09:54+00:00,MotormanNo3,RT 7 anggota Resmob diduga terlibat dalam pembantaian 6 Laskar FPI Dalam melaksanakan tiga surat perintah Briptu Fikri Ramadhan
2022-01-04 09:09:50+00:00,Bacan66311513,RT ad Min ada berita menarik di papua ni
2022-01-04 09:09:48+00:00,SinarOnline,Kerajaan akan menanggung kos urusan kuarantin termasuk makan minum dan pengangkutan dari lapangan terbang bagi jem
2022-01-04 09:09:40+00:00,dea8h,RT Pagi tadi saya dihubungi pihak media berkenaan berita ini Saya mengesahkan bahawa YB Hilman Idham telah memfailkan saman
2022-01-04 09:09:37+00:00,Ferry13602224,RT Ceramah menuduh Polri membunuh 6 FPI pengawal Rizieq Difitnah dgn keji dgn kata Dibunuh disiksa dikuliti dicabut k
2022-01-04 09:09:36+00:00,KATADATAcoid,Ketum PBNU Tak Mau Jadi Alat Politik PKB Jadi Angin Segar Parpol Lain
2022-01-04 09:09:34+00:00,wahyuyl,RT 93 BREAKING NEWS Polda Jawa Barat Jabar menetapkan Habib Bahar bin Smith sebagai tersangka kasus penyebaran berita bohong
2022-01-04 09:09:30+00:00,detikcom,Amel wanita asal Depok Jawa Barat sudah enam hari mencari ayahnya Budiono 61 yang hilang Ayahnya meninggalka
2022-01-04 09:09:28+00:00,firdaussyahmi26,RT Pendiriannya itu mencetus tentangan daripada para pegawai Israel dan juga pujian daripada pengguna media sosial yang pro Pale
